file_name,track_name,artist,lyrics
share_video_7339723452598865194_.mp3,redrum (Mixed),21 Savage,"[Intro]
Cai, a noite sobre o nosso amor
Cai, e agora só restou do amor
Uma palavra: Adeus
Woah, woah, woah
[Chorus]
Want it all, I won't leave a breadcrumb
Bitch, what? I thought a nigga said somethin’
Thought a nigga said somethin'
G Block, all we know is redrum
Redrum, redrum, redrum, redrum
G Block, all we know is redrum
Redrum, redrum, redrum, redrum
Nigga, all we know is— (Redrum)
[Verse 1]
Ridin' in the back, it’s a May' (It's a May')
Thirty-two shots in the K (In the K)
Marathon, I really run the A (Run the A)
Say you touched me, how, Sway? (How, Sway?)
Graveyard, that's where the opps stay (Opps stay)
Hypnotize, they do what I say (What I say)
21, niggas don't play (Don't play)
My Glock Gen5 said hey (Said hey)
Take my choppеr everywherе, that's bae (That’s bae)
Get yo’ ass out the car, you givin' Tre (Givin’ Tre)
We been spinnin' through they hood all day (All day)
Niggas say they outside, okay, okay
I can't let a bitch play me, no way (No way)
You a duck if you believe what hoes say (What hoes say)
She got way more bodies than my old K (Old K)
My lil' brother beat his body, OJ (OJ)
Niggas talkin’ 'bout they lit, I'm La Flame (Pussy)
That lil' boy a mascot, he ain't gang (Pussy)
Watch a half a million dollars and it's plain (Pussy)
I don't go through TSA to get on planes (Pussy)
You get pussy without head, then you lame (Pussy)
She knew I was leavin' 'fore I even came (Pussy)
Two revolvers on my waist, John Wayne (Pussy)
Smack niggas, then I get on Live and sing (Yeah)"
share_video_7322119920177761578_.mp3,Ain't No Mountain High Enough (feat. Dionne Bromfield) [Radio Edit],Freischwimmer,"[Intro: Marvin Gaye]
Listen, baby
[Verse 1: Marvin Gaye,
Tammi Terrell
&
Both
]
Ain't no mountain high, ain't no valley low
Ain't no river wide enough, baby
If you need me, call me, no matter where you are
No matter how far,
don't worry, baby
Just call my name, I'll be there in a hurry
You don't have to worry,
'cause, baby, there
[Chorus: Marvin Gaye & Tammi Terrell]
Ain't no mountain high enough
Ain't no valley low enough
Ain't no river wide enough
To keep me from gettin' to you, baby
[Verse 2: Marvin Gaye,
Marvin Gaye & Tammi Terrell
]
Remember the day I set you free
I told you you could always count on me, darlin'
From that day on, I made a vow
I'll be there when you want me, someway, somehow
Oh, baby, there
[Chorus: Marvin Gaye & Tammi Terrell]
Ain't no mountain high enough
Ain't no valley low enough
Ain't no river wide enough
To keep me from gettin' to you, babe"
share_video_7337500233632402731_.mp3,Merry Go Round of Life (Old Piano),Xakei,This song is an instrumental
share_video_7320727049809825066_.mp3,Leni,Crystal Castles,"[Verse 1]
Light of God dimming weak
Nothing's wrong go back to sleep
Lost the will at infancy
Drown them in charity
Lend them comfort for sorrow
Enthusiasm they borrow
I can clean impurity
Wash away with kerosene
[Verse 2]
Can't offend my modesty
Thank you for defiling me
Language pure as binary
Instruct with dishonesty
In nature there's no tragedy
Bandage them in tapestry
Trade comfort for identity
Drown me in kerosene
Kerosene
[Refrain]
I'll protect you from
All the things I've seen
And I'll clean your wounds
Rinse them with saline"
share_video_7325232564233424161_.mp3,Safe and Sound,Capital Cities,"[Verse 1]
I could lift you up
I could show you what you wanna see
And take you where you wanna be
You could be my luck
Even if the sky is falling down
I know that we'll be safe and sound
[Chorus]
We're safe and sound
[Verse 2]
I could fill your cup
You know my river won't evaporate
This world we still appreciate
You could be my luck
Even in a hurricane of frowns
I know that we'll be safe and sound
[Chorus]
(Safe and sound)
We're safe and sound
(Safe and sound)
We're safe and sound
(Hold your ground)
We're safe and sound
(Safe and sound)"
share_video_7338207576821108011_.mp3,RAHHHH (sped up),Alt!,"[Intro]
""And here comes #13, Mr. Alt
Comin' from the three point line, right now
Oh shit, that n****'s dead!
Oh my fucking god, n****!""
[Verse]
Ahhhh!
Oh, he talkin' out his neck, he gon' meet that fuckin' ""RAHHHH""
We gon' kick yo door, one, two, three and four, you hear that ""RAHHHH""
Murder, what she wrote? Saw him in my scope, I'm bouta ""RAHHHH""
Front page of the post, he ain't get a note, that n**** died
Knock up at yo door, let me in, bitch, I'm gon' that neck
Fuck he talkin' fo'? Stay up on that bench, don't get pressed
I might take yo hoe, give and go, pass her to my left
And that fire I tote, lethal weapon, it rip through yo chest
Heard she got a big ol' booty, told that bitch to makе it bounce
I'ma get up in the coochiе, kill the cat, then dog her out
They gon' ""Arf"", when I ""Arf"", 'cause they know what I'm about
Shit get wicked on this side, I suggest a different route
[Bridge]
(Ahhhh!)
Gonna fuck that n**** up (Ahhhh!)
Gonna fuck that n**** up
(Ahhhh!)"
share_video_7332931934269590817_.mp3,We Found Love (feat. Calvin Harris),Rihanna,"[Intro: Calvin Harris]
Ushuaïa, if you know the words, let me hear you sing it
[Verse: Rihanna]
Yellow diamonds in the light
And we're standing side by side
As your shadow crosses mine
What it takes to come alive
[Pre-Chorus: Rihanna]
It's the way I'm feelin', I just can't deny
But I've gotta let it go
[Chorus: Rihanna]
We found love in a hopeless place
We found love in a hopeless place
We found love in a hopeless place
We found love in a hopeless place
[Instrumental Drop]
[Bridge: Rihanna]
Yellow diamonds in the light
And we'rе standing side by side
As your shadow crosses minе"
share_video_7317137275266157866_.mp3,Milord,Édith Piaf,"Allez, venez, Milord!
Vous asseoir à ma table;
Il fait si froid, dehors
Ici c'est confortable
Laissez-vous faire, Milord
Et prenez bien vos aises
Vos peines sur mon coeur
Et vos pieds sur une chaise
Je vous connais, Milord
Vous ne m'avez jamais vue
Je ne suis qu'une fille du port
Qu'une ombre de la rue...
Pourtant je vous ai frôlé
Quand vous passiez hier
Vous n'étiez pas peu fier
Dame! Le ciel vous comblait:
Votre foulard de soie
Flottant sur vos épaules
Vous aviez le beau rôle
On aurait dit le roi...
Vous marchiez en vainqueur
Au bras d'une demoiselle
Mon Dieu!... Qu'elle était belle...
J'en ai froid dans le coeur...
Allez, venez, Milord!
Vous asseoir à ma table;
Il fait si froid, dehors
Ici c'est confortable
Laissez-vous faire, Milord
Et prenez bien vos aises
Vos peines sur mon coeur
Et vos pieds sur une chaise
Je vous connais, Milord
Vous ne m'avez jamais vue
Je ne suis qu'une fille du port
Qu'une ombre de la rue...
Dire qu'il suffit parfois
Qu'il y ait un navire
Pour que tout se déchire
Quand le navire s'en va...
Il emmenait avec lui
La douce aux yeux si tendres
Qui n'a pas su comprendre
Qu'elle brisait votre vie
L'amour, ça fait pleurer
Comme quoi l'existence
Ça vous donne toutes les chances
Pour les reprendre après...
Allez, venez, Milord!
Vous avez l'air d'un môme!
Laissez-vous faire, Milord
Venez dans mon royaume:
Je soigne les remords
Je chante la romance
Je chante les milords
Qui n'ont pas eu de chance!
Regardez-moi, Milord
Vous ne m'avez jamais vue...
...Mais vous pleurez, Milord?
Ça je l'aurais jamais cru!
Eh bien, voyons, Milord!
Souriez-moi, Milord!
...Mieux que ça! Un petit effort...
Voilà, c'est ça!
Allez, riez, Milord!
Allez, chantez, Milord!
La-la-la...
Mais oui, dansez, Milord!
La-la-la...
Bravo Milord!
La-la-la...
Encore Milord!
La-la-la..."
share_video_7342951680654298410_.mp3,Everything Works Out in the End,Kodaline,"[Verse 1]
I never seen it coming
I couldn't read the signs
But I know that it means nothing
But you are always on my mind
I got tricked into believing
You were the only one for me
But the truth can be deceiving
And I was just too young to see
[Chorus]
They told me
Everything works out in the end
Everything works out in the end
They told me
Everything works out in the end
Everything works out in the end
[Verse 2]
You got me treading on the water
Because I've never learned to swim
And now that it's all over
I better learn to start again
[Chorus]
They told me
Everything works out in the end
Everything works out in the end
They told me
Everything works out in the end
Everything works out in the end"
share_video_7340688686008306951_.mp3,The Way I Are,"Timbaland, Keri Hilson & D.O.E.","[Intro: Lene Nystrøm,
René Dif
]
Hiya,
Barbie
Hi, Ken
You wanna go for a ride?
Sure, Ken
Jump in
[Chorus: Lene Nystrøm,
René Dif
]
I'm a Barbie girl in the Barbie world
Life in plastic, it's fantastic
You can brush my hair, undress me everywhere
Imagination, life is your creation
Come on, Barbie, let's go party
I'm a Barbie girl in the Barbie world
Life in plastic, it's fantastic
You can brush my hair, undress me everywhere
Imagination, life is your creation
[Verse 1: Lene Nystrøm,
René Dif
]
I'm a blonde bimbo girl in a fantasy world
Dress me up, make it tight, I'm your dolly
You're my doll, rock and roll, feel the glamor in pink
Kiss me here,
touch me
there, hanky-panky
[Refrain: Lene Nystrøm]
You can touch, you can play
If you say I'm always yours, ooh woah"
share_video_7310318947826421010_.mp3,Hey Daddy (Daddy's Home) [feat. Plies],USHER,"[Verse 1: Usher]
I just wanna get your attention
I really wanna be all up in your head (turn the lights on)
'Cause what I got, you going to get some
But girl, that's only if you ain't scared
[Bridge: Usher]
And I won't knock, won't ring no bells
You just float that bottom up in the air
I'll get you hot, I know you oh so well
And when I walk in, all that I wanna hear
[Chorus: Usher &
Ladies
]
Is you say, ""Daddy's home, home for me""
And I know you've been waiting for this loving all day
You know your daddy's home and it's time to play
(Daddy's home, so it's time to play)
So you ain't got to give my loving away
So all my ladies, say, ""Hey, hey, hey, daddy""
Hey, hey, hey, daddy
So all my ladies, say, ""Hey, hey, hey, daddy""
Hey, hey, hey, daddy
(Hey, south side)
[Verse 2: Usher]
I ain't gotta do a lot of flexing
Shorty, you already know what it is, yeah
And girl, tonight we gonna do a lot of sexing, yeah
Can't nobody do your body like this"
share_video_7329202393692835073_.mp3,One Of The Girls,"The Weeknd, JENNIE & Lily Rose Depp","[Intro: JENNIE]
Lock me up and throw away the key
He knows how to get the best out of me
I'm no force for the world to see
Trade my whole life just to be
[Verse 1: The Weeknd]
Tell nobody I control you
I broke you just to own you
They can't tell but I love you
'Cause you're loyal, baby
I love when you're submissive
You love it when I break skin
You feel pain without flinchin'
So say it
[Pre-Chorus: Lily-Rose Depp]
Give me tough love
Leave me with nothin' when I come down
My kind of love
Force me and choke me 'til I pass out
[Chorus: Lily-Rose Depp]
We don't gotta bе in love, no
I don't gotta be the onе, no
I just wanna be one of your girls tonight
We don't gotta be in love, no
I don't gotta be the one, no
I just wanna be one of your girls tonight, oh"
share_video_7330154311105760554_.mp3,Little Life,Cordelia,"[Verse 1]
How would you have me described?
With light?
With words you think that I'd like?
If I found out that I could flight
Would I take you out tonight?
[Pre-Chorus]
A little bit more, a little bit less
A little bit harder than I thought they said
A little bit fine, a little bit stressed
A little bit older than I thought I'd get
But I
[Chorus]
I think I like this little life
This little life
I think I like this little life
This silly little life
[Verse 2]
Eyes, smiling over candles
Mismatched chairs
Arms crossing where those hands go
It's loud, but that volume makes my heart glow
And time isn't real as the sun goes
Oh, oh, oh"
share_video_7329978546355686702_.mp3,Funked Up (Slowed),Xxanteria & isq,"[Intro]
(O-o-ooh!)
(Yeah-ah-ah-ah!)
(O-o-ooh!)
(Yeah-ah-ah-ah!)
[Chorus]
Uh, uh, uh, uh
Uh, uh, uh, uh
U-u-u-u-uh, uh, uh, uh
Uh, uh, uh, uh
U-uh, uh, uh, uh
Uh, uh, uh, uh
U-u-u-u-uh, uh, uh, uh
Uh, uh, u-u-uh-h, uh
[Bridge]
O-o-ooh! (
Yeah-ah-ah-ah!
)
O-o-ooh! (
Yeah-ah-ah-ah!
)
O-o-ooh! (
Yeah-ah-ah-ah!
)
O-o-ooh! (
Yeah-ah-ah-ah!
)
Yeah-ha-ha (Yeah-ha) Yeah-ha-ha (Yeah-ha)
Yeah-ha-ha (Yeah-ha) Yeah-ha-ha (Yeah-ha)
[Chorus]
Uh, uh, uh, uh
Uh, uh, uh, uh
U-u-u-u-uh, uh, uh, uh
Uh, uh, uh, uh
U-uh, uh, uh, uh
Uh, uh, uh, uh
U-u-u-u-uh, uh, uh, uh
Uh, uh, u-u-uh-h, uh"
share_video_7341496746863758625_.mp3,Bitch Better Have My Money,Rihanna,"[Intro]
Yayo, yayo
Mula-la
Yayo
[Verse 1]
Bitch better have my money
Y'all should know me well enough
Bitch better have my money
Please don't call me on my bluff
Pay me what you owe me
Ballin' bigger than LeBron
Bitch, give me your money
Who y'all think y'all frontin' on?
[Pre-Chorus]
Like bra, bra, bra
Louis XIII, and it's all on me, nigga, you just bought a shot
Kamikaze, if you think that you gon' knock me off the top
Shit, your wife in the backseat of my brand new foreign car
Don't act like you forgot
I call the shots, shots, shots
Like bra, bra, bra
Pay me what you owe me, don't act like you forgot
[Chorus]
Bitch better have my money
Bitch better have my money
Pay me what you owe me
Bitch better have my (Bitch better have my)
Bitch better have my (Bitch better have my)
Bitch better have my money"
share_video_7335512403507072289_.mp3,Swan Lake Suite,The Sign Posters,This song is an instrumental
share_video_7323253831528123690_.mp3,illicit affairs,Taylor Swift,"[Verse 1]
Make sure nobody sees you leave
Hood over your head, keep your eyes down
Tell your friends you're out for a run
You’ll be flushed when you return
Take the road less traveled by
Tell yourself you can always stop
What started in beautiful rooms
Ends with meetings in parking lots
[Chorus]
And that's the thing about illicit affairs
And clandestine meetings and longing stares
It's born from just one single glance
But it dies and it dies and it dies
A million little times
[Verse 2]
Leave the perfume on the shelf
That you picked out just for him
So you leave no trace behind
Like you don’t even exist
Take the words for what they are
A dwindling, mercurial high
A drug that only worked
The first few hundred times"
share_video_7336923015030066464_.mp3,Water (Mixed),Tyla,"[Intro]
Make me sweat, make me hotter
Make me lose my breath, make me water
Make me sweat, make me hotter
Make me lose my breath, make me water
[Verse 1]
Normally, I can keep my cool
But tonight, I'm wildin'
I'ma be (Yeah) in a dangerous mood
Can you match my timing? (Mm, mm)
Tellin' me (Yeah) that you really 'bout it
Why try hide it? Ooh
Talk is cheap, so show me
That you understand how I like it
[Pre-Chorus]
Can you blow my mind?
Set off my whole body
If I give you my time (Ooh)
Can you snatch my soul from mе?
I don't wanna wait, come take it
Take mе where I ain't been before
Can you blow my mind?2
[Chorus]
Make me sweat, make me hotter
Make me lose my breath, make me water
Make me sweat, make me hotter
Make me lose my breath, make me water"
share_video_7340678158188072238_.mp3,Dumptruck,Kinfolk Thugs,"[Intro]
Ah-where they at?
(K-K-K-Kin Folk Thugs)
(Hey, hey) I love the way you work it
(Hey, hey) I love the way you work it
Right about now
(Hey, hey) I love the way you work it
This where all the fine ladies take the floor
(Hey, hey) I 'm talkin' 'bout that dump truck
Let me see that dump truck, baby
(
Hey, ladies
)
Now, don't worry bout' it, some dump trucks bigger than others
(
You, you drive me crazy
) It ain't the size of that thang
It's how you dump that dump truck
You know what I'm talkin' 'bout?
[Chorus]
I'm talkin' 'bout that dump truck (C'mon)
Now back it up and dump it (
Hey, ladies
)
Back it up and dump it on me
Back it up and dump it
Back it up and dump it on me
Back it up and dump it
(
You, you drive me crazy
)
Back it up and dump it on me
Back it up and dump it
I'm talkin' 'bout that dump truck"
share_video_7319370686206823726_.mp3,Over and Over,The Altons,"I know that I do wrong
It shows in your eyes
This heart's been trying to hold on
I let the moment pass me by
Oh I've been trying
(I've been trying girl)
Oh I've been trying
(Over and over)
For you
Let’s start over
(Over and over)
Let's talk it over
Please come back home
I knew I was wrong girl
Oh I've been trying
(I've been trying girl)
Oh I've been trying
(Over and over)
For you
Let’s start over
(Over and over)
Now let's talk it over"
share_video_7339697588137987359_.mp3,CARNIVAL (feat. Playboi Carti),"¥$, Kanye West, Ty Dolla $ign & Rich The Kid","[Intro: Choir &
Playboi Carti
]
Go, go, go, go
Head so good, she a honor roll
She ride the dick like a carnival
I done did the impossible
Go, go, go, go
Head so good, she a honor roll
She ride the dick like a carnival
I done did the impossible
Go
Ha, ha, ha,
schyeah
[Verse 1: Rich The Kid &
Playboi Carti
]
Way too rich to drive a Rove'
Made a milli' off the stove
She like to put it in her nose
Pretty bitch with white toes
I done put on all the bros
I done fucked her in the Rolls (
Hahahaha
)
I done pulled up in the Ghost
I done reachеd all my goals
Yeah, yeah, pull up with Yeezy and Dolla $ign
I'm all about business, I'm mindin' minе
Pull up in the trenches like Columbine
Pull up with the rocket like NumbaNine
I don't want your hoes
Young nigga reach all the goals
Let her suck the dick, said she was a pro
If she scrape her teeth, I'ma tell her to go"
share_video_7340883054086458667_.mp3,Made for Me,Muni Long,"[Intro]
Mm
Oh
[Verse 1]
The smell of your perfume
I thought I was immune
Lookin' around this room
Can't help but see the traces of you
This moment is surreal
I can't put into words how I feel
[Pre-Chorus]
Twin
Where have you been?
[Chorus]
Nobody knows me like you do (Nobody)
Nobody gon' love me quite like you (Nobody, yeah)
Can't even deny it, every time I try it
One look in my eyes, you know I'm lyin', lyin'
Body to body, skin to skin (I'm never gon' love like this)
I'm never gon' love like this again (Again, yeah)
You were made for me (Just for me)
Said you were made for me (Only for me, yeah, yeah)
Think you were made for me
Oh yeah, you were made for me"
share_video_7324031406592527649_.mp3,Never Lose Me (Mixed),Flo Milli,"[Intro: Flo Milli]
Never had a bitch like me in your life
You ain't never had a bitch like me in your life, uh
Never had a bitch like me in your life
You ain't never had a bitch like me in your life (Yeah)
[Verse 1: Flo Milli]
He speed in the Wraith while his hand on my coochie (Yeah)
He touchin' Emilio Pucci (Uh)
Doin' good, bitch, I'm Gucci (I'm good)
Fly to Asia, he feedin' me sushi (Ooh)
When we fuckin', it feel like a movie
Raw bitch, ain't never been a groupie
Stiff on a ho, I like my nigga bougie (Yeah)
Tell me you don't nevеr wanna lose me
[Chorus: Flo Milli]
Tell mе you don't never wanna lose me
Tell me you don't never wanna lose me
Tell me you don't never wanna lose me
Tell me you don't never wanna lose me
Tell me you don't never wanna lose me
Tell me you don't never wanna lose me (Lose me)
Tell me you don't never—
[Verse 2: Flo Milli]
Keep me a Haitian, I love me a Zoe
I've been thinkin' 'bout you on the road
We havin' rich sex on a boat
He hit it back to back like it's dope (Like it's dope)
How you gon' prove you could treat me right?
You stole my heart like a thief in the night
Yeah, he my man, he was never your type
If you try me, ho, it's on sight
He totin' the Uzi, but he actin' real bougie (Bougie, yeah)
I like to fight over dick, ho, don't get hit with the two-piece (Two-piece)
You know you can call if you need me
Tell me you ain't never ever leavin' (No)
When I suck it, I look in your eyes (Yeah)
You better fuck me like you mean it (Fuck me like you mean it)"
share_video_7319928951453928747_.mp3,Somewhere Only We Know,Sofia Peters,"[Verse 1]
I walked across an empty land
I knew the pathway like the back of my hand
I felt the earth beneath my feet
Sat by the river and it made me complete
[Refrain]
Oh, simple thing, where have you gone?
I'm getting old and I need something to rely on
So tell me when you're gonna let me in
I'm getting tired and I need somewhere to begin
[Verse 2]
I came across a fallen tree
I felt the branches of it looking at me
Is this the place we used to love?
Is this the place that I've been dreaming of?
[Pre-Chorus]
Oh, simple thing, where have you gone?
I'm getting old and I need something to rely on
So tell me when you're gonna let me in
I'm getting tired and I need somewhere to begin
[Chorus]
And if you have a minute, why don't we go
Talk about it somewhere only we know?
This could be the end of everything
So why don't we go somewhere only we know?"
share_video_7329654958834634030_.mp3,Poker Face,Lady Gaga,"[Intro]
Mum mum mum mah
Mum mum mum mah
Mum mum mum mah
Mum mum mum mah
Mum mum mum mah
[Verse 1]
I wanna hold 'em like they do in Texas, please (Woo)
Fold 'em,
let 'em hit me, raise it, baby, stay with me (I love it)
LoveGame intuition, play the cards with spades to start
And after he's been hooked, I'll play the one that's on his heart
[Pre-Chorus]
Oh, woah-oh, oh, oh
Oh-oh-oh-oh-oh-oh
I'll get him hot, show him what I've got
Oh, woah-oh, oh, oh
Oh-oh-oh-oh-oh-oh
I'll get him hot, show him what I've got
[Chorus]
Can't read my, can't read my
No, he can't read my poker face
(She's got me like nobody)
Can't read my, can't read my
No, he can't read my poker face
(She's got me like nobody)"
share_video_7330383703002123553_.mp3,DJ Slow with You (Remix),Diar,"[Music]
in days the night's getting
colder in the end a heartbe
away I can feel the storm's getting
closer and that's when I remember what
you say I follow
you I you do never let
you you I
why know something
[Music]
do
[Music]
the crows they are getting
darker and home is far far
away my whole world just keeps getting
colder that's when I remember what you
say I follow you night I have here you
say prise you
I
never so foll through the night I your
[Music]
eyes
[Music]
[Music]
a"
share_video_7343689169253797163_.mp3,Tadow,Masego & FKJ,"[Intro]
Yeeah, ooh, yeh
Ayy, ayy, ayy, oh, ahh
Ayy, ayy, ahh, ahh
Tadow
Ayy, ayy, ay, oh, ahh
Ayy, ayy, ahh, ahh
Tadow
[Verse 1]
I saw her and she hit me like (Tadow)
Saw that thing so beautiful (Tadow)
She just hit my heart, oh (Tadow)
Full force and she got me like (Tadow)
[Pre-Chorus]
I be like (Tadow) Baby (Tadow)
Why you so fine? (Tadow, tadow)
Gotta make you mine (Tadow, tadow)
So hard to find (Tadow, tadow)
[Verse 2]
Baby like oh, how'd you do the thing?
The way that you do it and she ain't even show, nothing
She be walking round so confident, so heaven-sent"
share_video_7320380446557113642_.mp3,I Wouldn't Mind,He Is We,"[Verse 1]
Merrily we fall out of line, out of line
I'd fall anywhere with you, I'm by your side
Swinging in the rain, humming melodies
We're not going anywhere until we freeze
[Pre-Chorus]
I'm not afraid anymore
I'm not afraid
[Chorus]
Forever is a long time
But I wouldn't mind spending it by your side
[Verse 2]
Carefully we'll place for our destiny
You came, and you took this heart and set it free
Every word you write or sing is so warm to me, so warm to me
I'm torn, I'm torn to be right where you are
[Pre-Chorus]
I'm not afraid anymore
I'm not afraid
[Chorus]
Forever is a long time
But I wouldn't mind spending it by your side
Tell me everyday I get to wake up to that smile
I wouldn't mind it at all
I wouldn't mind it at all"
share_video_7325165295734181128_.mp3,Never Be Like You (feat. Kai),Flume,"[Verse 1]
What I would do to take away
This fear of being loved, allegiance to the pain
Now I'm fucked up and I'm missing you
He'll never be like you
I would give anything to change
This fickle-minded heart that loves fake shiny things
Now I'm fucked up and I'm missing you
He'll never be like you
[Chorus]
I'm only human, can't you see? I made, I made a mistake
Please just look me in my face, tell me everything's okay
'Cause I got it, ooh, he'll never be like you
I'm only human, can't you see? I made, I made a mistake
Please just look me in my face, tell me everything's okay
'Cause I got it, ooh, he'll never be like you
[Verse 2]
How do I make you wanna stay?
Hate sleeping on my own, missing the way you taste
Now I'm fucked up and I'm missing you
He'll never be like you
Stop looking at me with those eyes
Like I could disappear and you wouldn't care why
Now I'm fucked up and I'm missing you
He'll never be like you"
share_video_7327678973079555371_.mp3,Edge,Rezz,This song is an instrumental
share_video_7308555003797540138_.mp3,MONACO (Mixed),Bad Bunny,"[Letra de ""MONACO (Mixed)""]
[Verso 1]
Dime (Ey; dime), dime, ¿esto es lo que tú quería'?
Yo soy fino (Uh), esto es trap de galería
Tú eres un charro, Rocky ""The Kid"", una porquería
Yo un campeón, Rocky Marciano, Rocky Balboa, Rocky Maivia
Tengo la ruta, tengo la vía, sí, tengo la vía
Los gasto de noche, facturo to' el día
Tanta plata que, que me gusta que
Me chapeen, por eso le meto a toa' estas arpía'
Ustedes no saben lo que es estar en altamar con doscientos cuero'
Que la azafata te mame el bicho en el cielo (Ey, ey)
Lo que es tirar quiniento' mil en el putero (Ey, ey, ey)
Por eso tu opinión me importa cero (Duh)
Por eso tú estás 101 en el top 100 y yo estoy primero
Ya no son rapero', ahora son podcastero'
Más que tú está cobrando mi barbero (Ey)
Chingando y viajando en el mundo entero (Ey, ey, ey), ey
[Coro]
Bebiendo mucha champaña, nunca estamos seco'
Primero llegó Verstappen, después llegó Checo
Si Pablo me viera, dirá que soy un berraco
Ustede' hablando mierda y yo y los mío' por Mónaco
Bebiendo mucha champaña, nunca estamos seco'
'Tán hablando solo', están hablando con el eco
El signo del dinero, ese e' mi nuevo zodiaco
Prende un puro, la familia está en Mónaco"
