file_name,track_name,artist,lyrics
share_video_7342584354205355310_.mp3,L.A.LOVE (La la) [feat. YG],Fergie,"[Produced by DJ Mustard]
[Intro: Fergie]
(La la la la la)
(La la la la la)
(La la la la la)
(La la la la la)
[Verse 1: Fergie]
Uh, tell 'em where I'm from
Finger on the pump, make the six straight jump from SoCal
Hollywood to the slums
Chronic smoke get burnt by the California sun
On the west side, east coast where you at?
Just got to New York like a net on a jet
To London, to Brazil, to Quebec
Like the whole damn world took effect to Ferg
Tell 'em
[Pre-Chorus: Fergie]
Laid back, slow down
Better represent when we come to your town
So lay back, slow down
Whatchu represent when we come to your town
Say, get in with the business
I'ma be there in a minute
I just booked a Paris ticket
Thinking Russia need a visit
I'ma run it to the limit
And be on my way to Venice
[Chorus: Fergie]
L.A. got the people saying (la la la la la)
Brooklyn saying (la la la la la)
Hacienda saying (la la la la la)
Vegas saying (la la la la la)
Rio saying (la la la la la)
Tokyo saying (la la la la la)
Down under saying (la la la la la)
Miami saying (la la la la la)
Jamaica
[Post-Chorus: Fergie]
Every city, every state, every country you know
All around the globe
Every city, every state, every country you know
This is how it goes
[Verse 2: Fergie]
Uh, tell 'em where I'm at
From the plaques to the (uh uh)
Everything fat
Got Mustard on a track
My girls all stack
When I roll down the window, let me know where you're
Atlanta, north-south cack a lack
Texas grill, Cadillacs through Miami then back
To London, Jamaica, then France
The whole damn world took effect to Ferg
Tell 'em
[Pre-Chorus: Fergie]
Laid back, slow down
Better represent when we come to your town
So lay back, slow down
Whatchu represent when we come to your town
Say, get in with the business
I'ma be there in a minute
I just booked a Paris ticket
Thinking Russia need a visit
I'ma run it to the limit
And be on my way to Venice
Get in with the business
When I come from Kansas City
Hit Manila till it's Christmas
Out to India I'll visit
Puerto Rico is exquisite
Bring my people back to Venice
[Chorus: Fergie]
L.A. got the people saying (la la la la la)
Moscow saying (la la la la la)
España (la la la la la)
Kingston saying (la la la la la)
San Diego saying (la la la la la)
Chi town saying (la la la la la)
Germany saying (la la la la la)
La Puente saying (la la la la la)
Ibiza"
share_video_7313436359119621419_.mp3,1 Thing,Amerie,"[Intro]
Woo!
Uh
Woo!
Na-na-na-na-na, oh (Uh, uh)
Na-na-na-na-na, oh (Uh, uh)
Na-na-na-na-na, oh (Uh, uh)
Na-na-na-na-na
[Verse 1]
Oh, been trying to let it go
Trying to keep my eyes closed
Trying to keep it just like before
The times we never even thought to speak
Don't wanna tell you what it is
Ooh-wee, it felt so serious
Got me thinking just too much
I wanna set it off, but
[Chorus]
It's this one thing that got me trippin'
It's this one thing that got me trippin' (You did)
This one thing, your soul made me feelin'
It's this one thing you did, oh-oh-oh-oh-oh
It's this one thing that caught me slippin'
It's this one thing, I want to admit it (You did)
This one thing and I was so with it
It's this one thing you did, oh-oh-oh-oh-oh"
share_video_7310268978365009185_.mp3,Surround Sound (feat. 21 Savage & Baby Tate),JID,"[Part I]
[Intro: Aretha Franklin]
I know I can't afford to stop for one moment
That it's too soon to for—
[Chorus: JID &
Aretha Franklin
]
Push the fuckin' pack off of the porch or break a pound down
Get this strap, if it happen to blow, it make surround sounds
Pussycat on my lap, push it back and go to town down (Oh, oh, woah)
Puttin' rap on my back, and I'm black and snatchin' crowns (Uh, woah, shit)
[Verse 1: JID &
Aretha Franklin
]
I done came back around
Like a nigga sellin' crack in pounds
I got a bag now, but it's nothing to brag 'bout
Gun blast in the background
(Doo-doo-doo, doo-doo-doo-doo)
I'm a black man with the bloodhounds
MAC-10 makin' love sounds
To a bad chick, she from Uptown
I'm from down South, not a loudmouth
(
Can't you see?
)
We can fuck around (Woah, shit, woah)
Hit the music, baby, cut it down (Woah, shit, woah)
Hit a doobie while you do me indubitably (Woah)
I feel like I'ma bust now
(Woah, shit, woah)
I feel like a bust down (Woah, shit, woah)
When I shine bright,
blind niggas is up now (Woah, shit, woah, shit)
In the cut, big black truck, pack sacked up (Woah, shit, woah, shit)
You can pick it up now, nigga, fuck it, okay (Woah, shit, ow, okay, ayy)"
share_video_7343443277103992110_.mp3,Your Love Is My Drug,Kesha,"[Verse 1]
Maybe I need some rehab
Or maybe just need some sleep
I got a sick obsession
I'm seein' it in my dreams
I'm lookin' down every alley
I'm makin' those desperate calls
I'm stayin' up all night hopin'
Hittin' my head against the wall
[Pre-Chorus]
What you've got, boy, is hard to find
I think about it all the time
I'm all strung out, my heart is fried
I just can't get you off my mind
[Chorus]
Because your love, your love, your love is my drug
Your love, your love, your love
I said your love, your love, your love is my drug
Your love, your love, your love
[Verse 2]
Won't listen to any advice
Momma's tellin' me I should think twice
But left to my own devices
I'm addicted, it's a crisis
My friends think I've gone crazy
My judgment's gettin' kinda hazy
My steeze is gonna be affected
If I keep it up like a lovesick crackhead"
share_video_7320343822997687584_.mp3,SexyBack,Justin Timberlake & Timbaland,"[Verse 1: Justin Timberlake &
Timbaland
]
I'm bringin' sexy back
(Yeah)
Them other boys don't know how to act
(Yeah)
I think it's special, what's behind your back?
(Yeah)
So turn around and I'll pick up the slack
(Yeah)
Take it to the bridge, c'mon
(Listen)
[Pre-Chorus: Justin Timberlake &
Timbaland
]
Dirty babe
(Uh-huh)
You see these shackles, baby, I'm your slave
(Uh-huh)
I'll let you whip me if I misbehave
(Uh-huh)
It's just that no one makes me feel this way
(Uh-huh)
Take it to the chorus
[Chorus: Timbaland &
Justin Timberlake
]
Come here, girl
(Go 'head, be gone with it)
Come to the back
(Go 'head, be gone with it)
VIP
(Go 'head, be gone with it)
Drinks on me
(Go 'head, be gone with it)
Let me see what you're twerkin' with
(Go 'head, be gone with it)
Look at those hips
(Go 'head, be gone with it)
You make me smile
(Go 'head, be gone with it)
Go 'head, child
(Go 'head, be gone with it)
And get your sexy on
(Go 'head, be gone with it)
Get your sexy on
(Go
'head, be gone with it)
Get your sexy on
(Go 'head, be gone with it)
Get your sexy on
(Go 'head, be gone with it)
Get your sexy on, ha
(Go 'head, be gone with it)
Get your sexy on
(Go 'head, be gone with it)
Get your sexy on
(Go 'head, be gone with it)
Get your sexy on"
share_video_7324359886584712481_.mp3,Reflections,Toshifumi Hinata,This song is an instrumental
share_video_7327633411722628398_.mp3,Fourth of July,Sufjan Stevens,"[Verse 1]
The evil, it spread like a fever ahead
It was night when you died, my firefly
What could I have said to raise you from the dead?
Oh, could I be the sky on the Fourth of July?
[Chorus 1]
""Well, you do enough talk
My little hawk, why do you cry?
Tell me, what did you learn from the Tillamook burn?
Or the Fourth of July?
We're all gonna die""
[Verse 2]
Sitting at the bed with the halo at your head
Was it all a disguise, like junior high?
Where everything was fiction, future, and prediction
Now, where am I? My fading supply
[Chorus 2]
""Did you get enough love, my little dove?
Why do you cry?
And I'm sorry I left, but it was for the best
Though it never felt right
My little Versailles"""
share_video_7331944271223754026_.mp3,Dumptruck,Kinfolk Thugs,"[Intro]
Ah-where they at?
(K-K-K-Kin Folk Thugs)
(Hey, hey) I love the way you work it
(Hey, hey) I love the way you work it
Right about now
(Hey, hey) I love the way you work it
This where all the fine ladies take the floor
(Hey, hey) I 'm talkin' 'bout that dump truck
Let me see that dump truck, baby
(
Hey, ladies
)
Now, don't worry bout' it, some dump trucks bigger than others
(
You, you drive me crazy
) It ain't the size of that thang
It's how you dump that dump truck
You know what I'm talkin' 'bout?
[Chorus]
I'm talkin' 'bout that dump truck (C'mon)
Now back it up and dump it (
Hey, ladies
)
Back it up and dump it on me
Back it up and dump it
Back it up and dump it on me
Back it up and dump it
(
You, you drive me crazy
)
Back it up and dump it on me
Back it up and dump it
I'm talkin' 'bout that dump truck"
share_video_7334853625367317793_.mp3,Toy Story: You've Got a Friend In Me,Geek Music,"[Verse 1]
You've got a friend in me
You've got a friend in me
When the road looks rough ahead
And you're miles and miles from your nice warm bed
You just remember what your old pal said
Boy, you've got a friend in me
Yeah, you've got a friend in me
[Verse 2]
You've got a friend in me
You've got a friend in me
You've got troubles, and I've got 'em, too
There isn't anything I wouldn't do for you
We stick together and we see it through
'Cause you've got a friend in me
You've got a friend in me
[Bridge]
Some other folks might be a little bit smarter than I am
Bigger and stronger too, maybe
But none of them will ever love you the way I do
It's me and you, boy
[Verse 3]
And as the years go by
Our friendship will never die
You're gonna see, it's our destiny
You've got a friend in me
You've got a friend in me
You've got a friend in me"
share_video_7323031521504431406_.mp3,Sweetest Pie,Megan Thee Stallion & Dua Lipa,"[Intro: Dua Lipa]
(
Mano
)
You've never been to Heaven, have you?
(
OG Parker
)
[Chorus: Dua Lipa &
Megan Thee Stallion
]
Ooh, this the ride of your life
Hold on 'cause, baby, I might
I might just give you a bite of the sweetest pie (
Yeah, yeah, yeah, ah
)
Ooh, baby, we can go fast
I'll drive and you just lay back
I got the flavour that lasts, yeah, the sweetest pie (
Uh-huh, uh-huh
)
I might take you home with this, I might give you all of it (
Yeah
)
Come get your dose of the sweetest pie
Ooh, this the ride of your life
Hold on 'cause, baby, I might
I might just give you a bite of the sweetest pie (
Uh-huh, uh-huh
)
[Verse 1: Megan Thee Stallion]
Baby, I'm the sweetest, pussy is the meanest (Yeah)
Hot girl shit, but I'm cold every season (But I'm)
Know he got that pipe, let him bust it 'til it's leakin' (Yeah, mwah)
Booty like a pillow, he can use it while he's sleepin' (Look)
Don't be goin' through my phone 'cause that's the old me (Old me)
Ain't the only one tryna be my one and only (Tryna)
Real thick, movin' slow, that body like codeine
He a player, but for Megan, he cuttin' the whole team (Hey, hey, hey, hey)
That body lookin' nice (Lookin' nice)
I got cake and I know he want a slice
I wish a nigga would try to put me on ice (Brrr)
I ain't never had to chase dick in my life (Dick in my life)
I like that nasty, that freaky stuff (Freaky stuff)
Slip under my bed and keep me up (Hey)
That Hansel and Gretel, let him eat me up (Ah)
Uh, uh, uh, uh, uh"
share_video_7331680039223708933_.mp3,Donk,Beyoncé,"[Verse]
As we sip champagne, watchin' Purple Rain
Body’s insane, how could you complain?
Plus, I know you love my personality
I think I wanna go back to school, and have my locker full of pictures of you
So give me that ""A"" in biology, I'm graduatin' soon
Mmm, it’s something 'bout that look you give me
Makin' me feel that young love inside
Mmm, it's something 'bout that feelin' you give me
I can't resist them butterflies
Mmm, you need a woman holdin' you down
Whenever, wherever, however, whatever, I’ll be right by your side
See I just wanna love ya, boy, if you don’t mind
Just kickin' this little game of mine
[Pre-Chorus]
And he said, ""Girls don’t dance no more, all they do is this""
(
Twerk sumn, twerk sumn, twerk sumn, twerk sumn, twerk sumn
)
Said, ""Girls don't dance no more, all they do is this""
(
Twerk sumn, twerk sumn, twerk sumn, twerk sumn, twerk sumn
)
No more slow jams, no more R&B
No more makin' love in between the sheets
See, ""Girls don't dance no more, all they do is this"" (
Twerk sumn
)
(Key, donkey, donk, key, donkey, donk)
[Chorus]
Donkey, donkey, donkey, donkey, donk’
Donkey, donkey, donkey, donkey, donk'
Donkey, donkey, donkey, donkey, donk'
Donkey, donkey, donkey, donkey, donk'"
share_video_7323574076390362370_.mp3,Never Lose Me (Mixed),Flo Milli,"[Intro: Flo Milli]
Never had a bitch like me in your life
You ain't never had a bitch like me in your life, uh
Never had a bitch like me in your life
You ain't never had a bitch like me in your life (Yeah)
[Verse 1: Flo Milli]
He speed in the Wraith while his hand on my coochie (Yeah)
He touchin' Emilio Pucci (Uh)
Doin' good, bitch, I'm Gucci (I'm good)
Fly to Asia, he feedin' me sushi (Ooh)
When we fuckin', it feel like a movie
Raw bitch, ain't never been a groupie
Stiff on a ho, I like my nigga bougie (Yeah)
Tell me you don't nevеr wanna lose me
[Chorus: Flo Milli]
Tell mе you don't never wanna lose me
Tell me you don't never wanna lose me
Tell me you don't never wanna lose me
Tell me you don't never wanna lose me
Tell me you don't never wanna lose me
Tell me you don't never wanna lose me (Lose me)
Tell me you don't never—
[Verse 2: Flo Milli]
Keep me a Haitian, I love me a Zoe
I've been thinkin' 'bout you on the road
We havin' rich sex on a boat
He hit it back to back like it's dope (Like it's dope)
How you gon' prove you could treat me right?
You stole my heart like a thief in the night
Yeah, he my man, he was never your type
If you try me, ho, it's on sight
He totin' the Uzi, but he actin' real bougie (Bougie, yeah)
I like to fight over dick, ho, don't get hit with the two-piece (Two-piece)
You know you can call if you need me
Tell me you ain't never ever leavin' (No)
When I suck it, I look in your eyes (Yeah)
You better fuck me like you mean it (Fuck me like you mean it)"
share_video_7319269139707612449_.mp3,Twelfth Street Rag,Sage Guyton & Jeremy Wakefield,This song is an instrumental
share_video_7322494909624093995_.mp3,Hier Encore,Charles Aznavour,"[Paroles de ""Hier encore""]
[Couplet 1]
Hier encore, j'avais vingt ans
Je caressais le temps, et jouais de la vie
Comme on joue de l'amour, et je vivais la nuit
Sans compter sur mes jours, qui fuyaient dans le temps
J'ai fait tant de projets, qui sont restés en l'air
J'ai fondé tant d'espoirs, qui se sont envolés
Que je reste perdu, ne sachant où aller
Les yeux cherchant le ciel, mais le cœur mis en terre
[Couplet 2]
Hier encore, j'avais vingt ans
Je gaspillais le temps, en croyant l'arrêter
Et pour le retenir, même le devancer
Je n'ai fait que courir, et me suis essoufflé
Ignorant le passé, conjuguant au futur
Je précédais de moi toute conversation
Et donnais mon avis, que je voulais le bon
Pour critiquer le monde, avec désinvolture
[Couplet 3]
Hier encore, j'avais vingt ans
Mais j'ai perdu mon temps à faire des folies
Qui ne me laissent au fond rien de vraiment précis
Que quelques rides au front, et la peur de l'ennui
Car mes amours sont mortes, avant que d'exister
Mes amis sont partis, et ne reviendront pas
Par ma faute j'ai fait le vide autour de moi
Et j'ai gâché ma vie, et mes jeunes années"
share_video_7339269183902960928_.mp3,Funny,Gold-Tiger,This song is an instrumental
share_video_7333187619150515458_.mp3,Karma (Sped up - Reverb) [Remix],ROSE BEAT,"[Verse 1]
You're talking shit for the hell of it
Addicted to betrayal, but you're relevant
You're terrified to look down
'Cause if you dare, you'll see the glare
Of everyone you burned just to get there
It's coming back around
[Pre-Chorus]
And I keep my side of the street clean
You wouldn't know what I mean
[Chorus]
'Cause karma is my boyfriend
Karma is a god
Karma is the breeze in my hair on the weekend
Karma's a relaxing thought
Aren't you envious that for you it's not?
Sweet like honey, karma is a cat
Purring in my lap 'cause it loves me
Flexing like a goddamn acrobat
Me and karma vibe like that
[Verse 2]
Spiderboy, king of thieves
Weave your little webs of opacity
My pennies made your crown
Trick me once, trick me twice
Don't you know that cash ain't the only price?
It's coming back around"
share_video_7318111472108834080_.mp3,Maneater,Nelly Furtado,"[Intro: Timbaland]
Take it back, take it back, take it back
Oh-oh-oh-ah-oh
Oh-ah-oh-oh-oh-ah
[Verse 1: Nelly Furtado &
Timbaland
]
Everybody look at me, me (
Oh
)
I walk in the door, you start screaming (
Oh
)
Come on, everybody, what you here for? (
Oh
)
Move your body around like a nympho (
Oh
)
Everybody get your necks to crack around (
Oh
)
All you crazy people, come on, jump around (
Oh
)
I wanna see you all on your knees, knees (
Oh
)
You either wanna be with me, or be me (
Come on, now
)
[Chorus: Nelly Furtado]
Maneater, make you work hard
Make you spend hard, make you want all of her love
She's a maneater, make you buy cars
Make you cut cards, make you fall real hard in love
She's a maneater, make you work hard
Make you spend hard, make you want all of her love
She's a maneater, make you buy cars
Make you cut cards,
wish you never ever met her at all
[Verse 2: Nelly Furtado &
Timbaland
]
And when she walks, she walks with passion (
Oh
)
When she talks, she talks like she can handle it (
Oh
)
When she asks for somethin', boy, she means it (
Oh
)
Even if you never ever seen it (
Oh
)
Everybody get your necks to crack around (
Oh
)
All you crazy people, come on, jump around (
Oh
)
You doin' anything to keep her by your side (
Oh
)
Because, she said she love you, love you long time (
Come on, now
)"
share_video_7338597910310898974_.mp3,Happy (Tik Tok Edit) [Remix],EDITKINGS,"[Produced by Pharrell Williams]
[Verse 1]
It might seem crazy what I'm 'bout to say
Sunshine she's here, you can take a break
I'm a hot air balloon that could go to space
With the air, like I don't care, baby, by the way, huh
[Chorus]
(Because I'm happy)
Clap along if you feel like a room without a roof
(Because I'm happy)
Clap along if you feel like happiness is the truth
(Because I'm happy)
Clap along if you know what happiness is to you
(Because I'm happy)
Clap along if you feel like that's what you wanna do
[Verse 2]
Here come bad news, talking this and that (Yeah!)
Well, give me all you got, don't hold it back (Yeah!)
Well, I should probably warn ya, I'll be just fine (Yeah!)
No offense to you, don’t waste your time, here's why
[Chorus]
(Because I'm happy)
Clap along if you feel like a room without a roof
(Because I'm happy)
Clap along if you feel like happiness is the truth
(Because I'm happy)
Clap along if you know what happiness is to you
(Because I'm happy)
Clap along if you feel like that's what you wanna do (Hey Come On Uh,)"
share_video_7343347344722709806_.mp3,Olivia Rodrigo,Omar Mosseri,This song is an instrumental
share_video_7320382240905497887_.mp3,Just Can't Get Enough,Nathan Smart,"Boy I think about it every night and day
I'm addicted wanna jump inside your love
I wouldn't wanna have it any other way
I'm addicted and I just can't get enough
I just can't get enough
I just can't get enough
I just can't get enough
I just can't get enough
Honey got a sexy all steamin'
She givin' hotness a new meanin'
Perfection mama you gleamin'
Inception you got a brother dreamin', dreamin'
Damn baby I'm feignin'
I'm tryna holler at you, I'm screamin'
Let me love you down this evenin'
Love you love you ya you know you are my demon
Girl we could form a team and
I could be the king you could be the queen and
My mind's dirty and it don't need cleanin'
I love you long time so you know the meanin'
Oh baby I can't come down so please come help me out
You got me feelin' high and I can't step off the cloud
And I just can't get enough
Boy I think about it every night and day
I'm addicted wanna drown inside your love
I wouldn't wanna have it any other way
I'm addicted and I just can't get enough
I just can't get enough
I just can't get enough
I just can't get enough
I just can't get enough
Honey got me runnin like I'm Flo Joe
Signs her name on my heart with an X-O
Love's so sweet got me vexed oh
I wanna wish it right back like presto, yes
Meantime I wait for the next time
She come around 'fore I toast to the best time
We L-O-L back and forth on the text line
She got me fishin' for her love I confess I'm
Somethin' 'bout her smile and that combo
Got me high and I ain't comin' down yo
My heart's pumpin' out louder than electro
She got me feelin' like Mr. Roboto
Oh baby I can't come down so please come help me out
You got me feelin' high and I can't step off the cloud
And I just can't get enough
Boy I think about it every night and day
I'm addicted, wanna drown inside your love
I wouldn't wanna have it any other way
I'm addicted and I just can't get enough
This has been a switch up
Switch up, switch up
I just can't not
Sunk in your bed rock
Caught up in your love shock
Knocked out by your cold shot
I'm stuck in your head li-
Switch up
Can't get out won't quit
Makin' me feign, give it to me
I want it all, know what I mean
Your love is a dose of ecstasy
Switch up
Addicted I can't get away from you
Afflicted, I need it, I miss it it
Switch up
I want your lovin' right next to me
And I can't erase ya out of my memory
I just can't
Switch up"
share_video_7321747840512937248_.mp3,Just Dance (feat. Colby O'Donis),Lady Gaga,"[Intro: Lady Gaga &
Akon
]
Truth!
RedOne
Konvict
Gaga (
Oh-oh, eh
)
[Verse 1: Lady Gaga &
Akon
]
I've had a little bit too much, much
(Oh, oh, oh-oh)
All of the people start to rush (Start to rush by)
A dizzy twister dance
, can't find my drink or man
Where are my keys? I lost my phone, phone
(Oh, oh, oh-oh)
[Pre-Chorus: Lady Gaga]
What's goin' on, on the floor?
I love this record, baby,
but I can't see straight anymore
Keep it cool, what's the name of this club?
I can't remember, but it's alright, a-alright
[Chorus: Lady Gaga]
Just dance
Gonna be okay, da-da-doo-doot-n
Just dance
Spin that record, babe, da-da-doo-doot-n
Just dance
Gonna be okay
Da-da-da-dance, dance, dance
Just, j-j-just dance"
share_video_7325472993465994529_.mp3,n.h.i.e.,21 Savage & Doja Cat,"[Intro: Doja Cat]
Ahem (Yeah, yeah)
Yeah, yeah (Yeah, yeah, yeah, sheesh)
[Chorus: 21 Savage &
Doja Cat
]
That ain't something I would do (
That ain't something, that ain't something
)
Hell nah, let you slide like it's cool (
That ain't something, that ain't
)
Nigga, hell nah, fake the truth (
Yeah, yeah
)
Play by rules (
Yeah, yeah
)
Play with you (
Yeah, yeah
)
That ain't something I would do
[Verse 1: 21 Savage]
I'm havin' plaques on plaques (Okay)
You niggas' streams ain't that (Okay)
I done seen a hater get whacked (Okay)
Hit him nine times, he a cat (Okay)
I grew up on the East, no cap (Okay)
Green Card, green tips in the strap
(Okay)
Keep talkin' 'bout where I was born (Okay)
Likе a nigga wanna still get clapped (Okay)
She sit on thе wood, no splinter (Facts)
New money like I got a printer
(Facts)
I ain't buyin' these bitches, I rent 'em (Facts)
These porcelain teeth, they not dentures (Facts)
Big VVS stones and they twinkle
(21)
I'm at Waffle House rollin' up Sprinkle
(21)
Let her ex call her phone 'til he wrinkle (21)
I'll pop at his ass, he a pimple"
share_video_7311039322520636715_.mp3,You'll Always Find Your Way Back Home,Ханна Монтана,"[Intro]
Woo!
[Verse 1]
You wake up
It’s raining and it’s Monday
Looks like one of those rough days
Time’s up
You’re late again, so get out the door (Out the door)
Sometimes you feel like running
Find a whole new life and jump in
Let go, get up and hit the dance-floor
[Pre-Chorus 1]
But when the lights go down, it’s the ending of the show (Show)
And you’re feeling like you got nowhere to go
Don’t you know...
[Chorus]
You can change your hair and you can change your clothes
You can change your mind, that’s just the way it goes
You can say ""goodbye,"" and you can say ""hello""
But you’ll always find your way back home
You can change your style, you can change your jeans
You can learn to fly and you can chase your dreams
You can laugh and cry, but everybody knows
You’ll always find your way back home"
share_video_7339524005071736110_.mp3,Wop (Official Version),J. Dash,"[Intro]
Uh-oh, uh-oh (
J. Dash
)
Uh-oh, uh-oh
[Chorus]
I made a little bit of money (I made a little bit of money)
I paid my bills (I paid my bills)
I paid this cover (I paid this cover)
I ain't finna stand still (I ain't finna stand still), 'cause now I'm finna
Wop, wop, wop, wop
Wop, wop, wop, now let me see you
Wop, wa-wa-wa-wop, wop, wa-wa-wa-wop (Yeah)
Wop, wa-wa-wa-wop, wop, wa-wa-wa-wop (Ayy)
[Verse 1]
Wop if you love me, get lost if you don't
Look at the reaction when I hit 'em with the funk
Got Fleezy in the back, got Chello in the front
Listen to the record, boy, I got what you want
Get so fly 'cause the club on jump
Got hits like the 'woofers beatin' the back of the trunk
Ladies take it back, throw back the donk
Bend at the waist, lean to the front
Now bounce your body to the beat just a little bit
Pause, shuffle yo' feet just a little bit
Ain't nobody here wop better than me
Purple flag to the left, who better than me?
I got a all-star squad, who better than me?
Man, listen to the beat, who better than me?
I paid to get in, so I ain't finna chill
And my week been way too long to stand still"
