file_name,track_name,artist,lyrics
share_video_7339573284847111429_.mp3,Made for Me,Muni Long,"[Intro]
Mm
Oh
[Verse 1]
The smell of your perfume
I thought I was immune
Lookin' around this room
Can't help but see the traces of you
This moment is surreal
I can't put into words how I feel
[Pre-Chorus]
Twin
Where have you been?
[Chorus]
Nobody knows me like you do (Nobody)
Nobody gon' love me quite like you (Nobody, yeah)
Can't even deny it, every time I try it
One look in my eyes, you know I'm lyin', lyin'
Body to body, skin to skin (I'm never gon' love like this)
I'm never gon' love like this again (Again, yeah)
You were made for me (Just for me)
Said you were made for me (Only for me, yeah, yeah)
Think you were made for me
Oh yeah, you were made for me"
share_video_7326537319517867297_.mp3,Where Is My Mind,Maxence Cyrin,This song is an instrumental
share_video_7323650832904228129_.mp3,redrum (Mixed),21 Savage,"[Intro]
Cai, a noite sobre o nosso amor
Cai, e agora só restou do amor
Uma palavra: Adeus
Woah, woah, woah
[Chorus]
Want it all, I won't leave a breadcrumb
Bitch, what? I thought a nigga said somethin’
Thought a nigga said somethin'
G Block, all we know is redrum
Redrum, redrum, redrum, redrum
G Block, all we know is redrum
Redrum, redrum, redrum, redrum
Nigga, all we know is— (Redrum)
[Verse 1]
Ridin' in the back, it’s a May' (It's a May')
Thirty-two shots in the K (In the K)
Marathon, I really run the A (Run the A)
Say you touched me, how, Sway? (How, Sway?)
Graveyard, that's where the opps stay (Opps stay)
Hypnotize, they do what I say (What I say)
21, niggas don't play (Don't play)
My Glock Gen5 said hey (Said hey)
Take my choppеr everywherе, that's bae (That’s bae)
Get yo’ ass out the car, you givin' Tre (Givin’ Tre)
We been spinnin' through they hood all day (All day)
Niggas say they outside, okay, okay
I can't let a bitch play me, no way (No way)
You a duck if you believe what hoes say (What hoes say)
She got way more bodies than my old K (Old K)
My lil' brother beat his body, OJ (OJ)
Niggas talkin’ 'bout they lit, I'm La Flame (Pussy)
That lil' boy a mascot, he ain't gang (Pussy)
Watch a half a million dollars and it's plain (Pussy)
I don't go through TSA to get on planes (Pussy)
You get pussy without head, then you lame (Pussy)
She knew I was leavin' 'fore I even came (Pussy)
Two revolvers on my waist, John Wayne (Pussy)
Smack niggas, then I get on Live and sing (Yeah)"
share_video_7330804667342966059_.mp3,Wonderwall,Oasis,"[Verse 1]
Today is gonna be the day that they're gonna throw it back to you
And by now, you shoulda somehow realised what you gotta do
I don't believe that anybody feels the way I do about you now
[Verse 2]
And backbeat, the word is on the street that the fire in your heart is out
I'm sure you've heard it all before, but you never really had a doubt
I don't believe that anybody feels the way I do about you now
[Pre-Chorus]
And all the roads we have to walk are winding
And all the lights that lead us there are blinding
There are many things that I would like to say to you, but I don't know how
[Chorus]
Because maybe
You're gonna be the one that saves me
And after all
You're my wonderwall
[Verse 3]
Today was gonna be the day, but they'll never throw it back to you
And by now, you shoulda somehow realised what you're not to do
I don't believe that anybody feels the way I do about you now"
share_video_7332692602669567275_.mp3,Next Level,aespa,"[에스파 ""Next Level"" 가사]
[Verse 1: Karina,
Giselle
]
I'm on the next level, yeah
절대적 룰을 지켜
내 손을 놓지 말아 결속은 나의 무기
광야로 걸어가
알아 네 home ground
위협에 맞서서
제껴라 제껴라 제껴라
[Pre-Chorus: All,
Winter
,
Ningning
]
Ooh-ooh-ooh, eeh!
상상도 못한 black out
유혹은 깊고 진해 (Too hot, too hot)
Ooh-ooh-ooh, eeh!
맞잡은 손을 놓쳐
난 절대 포기 못해
[Chorus: Karina,
Ningning
]
I'm on the next level
저 너머의 문을 열어
Next level 널 결국엔 내가 부셔
Next level, KOSMO에 닿을 때까지
Next level 제껴라 제껴라 제껴라"
share_video_7338626120914423086_.mp3,What You Won't Do for Love,Bobby Caldwell,"[Verse 1]
I guess you wonder where I've been
I searched to find a love within
[Refrain]
I came back to let you know
Got a thing for you and I can't let go
[Verse 2]
My friends wonder what is wrong with me
Well, I'm in a daze from your love, you see
[Refrain]
I came back to let you know
Got a thing for you and I can't let it go
[Pre-Chorus]
Some people go around the world for love
But they may never find what they dream of
[Chorus]
What you won't do, do for love
You've tried everything, but you don't give up
In my world, only you
Make me do for love what I would not do"
share_video_7322226288582757678_.mp3,Think U The Shit (Fart),Ice Spice,"[Intro]
What the fuck I'ma say in the intro?
Hahaha
You want me to say somethin' so bad
(
Stop playin' with 'em, Riot
)
Can you, please?
[Chorus]
Think you the shit, bitch?
You not even the fart (Grrah)
I be goin' hard (Grrah)
I'm breakin' they hearts, like
Bitches be quick, but I'm quicker (Like)
Bitches be thick, but I'm thicker
(Like)
She could be rich, but I'm richer (Damn)
[Verse 1]
Take-takin' her man (Takin' her man)
Don't give a fuck (Don't give a fuck)
Out in the Yams (Out in the Yams)
And I'm keepin' one tucked (Keepin' one tucked)
I make me some jams (I make me some jams)
Unlock that advance (Unlock that advance)
I said four hundred bands (I said four hundred bands)
Just to do my lil' dance (Grrah)
Bitch, I'm a brand (Like)
Bitch, I'm a baddie, I get what I want (Damn)
All in Balenci', I look like a bum
I got the jatty, he just wanna hump (Hump)
Walk through and start shakin' my hips
I'ma dip when I stack all my chips (Like)
Strip a dummy, I want the whole 'fit
I got a French nigga sendin' me tips, grrah"
share_video_7325160950976515370_.mp3,Back To The Basics,Lana Del Rey,"[Intro]
C'mon
[Verse 1]
Baby, we could go
back to the basics
Trailer park love, wearing them ASICS and gold
I can speak Spanish
You can sing for the neighbors
You've been pretty stupid ever since you got famous
[Pre-Chorus 1]
Oh-oh, oh-oh, wrong side of the tracks, boy
Oh-oh, oh-oh, if only we'd go backward
'Cause nobody does it like you
I like the way that you move
That's why I never go through
With leaving you
[Chorus]
Everybody's saying that you're no good for me
Your friends all swear that you've changed
But I
still keep it O.G
This tune could be a reminder of how it all used to be
So shut up, and come on, sing our song
And let's go back to the basics
Let's go back to the basics, baby
Back to the basics
When you're not wasted, I know you'll see"
share_video_7341500656395488544_.mp3,Pour It Up,Rihanna,"[Chorus]
Throw it up, throw it up
Watch it all fall out
Pour it up, pour it up
That's how we ball out
Throw it up, throw it up
Watch it all fall out
Pour it up, pour it up
That's how we ball out
[Verse 1]
Strip clubs and dolla' bills, I still got mo' money
Patron shots can I get a refill
I still got mo' money
Strippers going up and down that pole
And I still got mo' money
Four o'clock and we ain't going home, 'cause I still got mo' money
Money make the world go round, I still got mo' money
Bands make your girl go down, I still got mo' money
Lot more where that came from, I still got mo' money
The look in your eyes I know you want some
And I still got mo' money...
[Pre-Chorus]
Oh-ohh-ohh, ohh, oh-oh-oh
All I see is signs, all I see is dolla' signs
Oh-ohh-ohh, ohh, oh-oh-oh
Money on my mind, money, money on my mind
Throw it, throw it up
Watch it fall out from the sky"
share_video_7339992661496991009_.mp3,Dumptruck,Kinfolk Thugs,"[Intro]
Ah-where they at?
(K-K-K-Kin Folk Thugs)
(Hey, hey) I love the way you work it
(Hey, hey) I love the way you work it
Right about now
(Hey, hey) I love the way you work it
This where all the fine ladies take the floor
(Hey, hey) I 'm talkin' 'bout that dump truck
Let me see that dump truck, baby
(
Hey, ladies
)
Now, don't worry bout' it, some dump trucks bigger than others
(
You, you drive me crazy
) It ain't the size of that thang
It's how you dump that dump truck
You know what I'm talkin' 'bout?
[Chorus]
I'm talkin' 'bout that dump truck (C'mon)
Now back it up and dump it (
Hey, ladies
)
Back it up and dump it on me
Back it up and dump it
Back it up and dump it on me
Back it up and dump it
(
You, you drive me crazy
)
Back it up and dump it on me
Back it up and dump it
I'm talkin' 'bout that dump truck"
share_video_7307717753425726762_.mp3,Strangers (Mixed),Kenya Grace,"[Intro]
Uh-huh, uh-huh, uh
Uh-huh, uh-huh, uh
Uh-huh, uh-huh, uh
Uh-huh, uh-huh
[Verse 1]
It always ends the same
When it was me and you
But every time I meet somebody new
It's like déjà vu (Déjà vu)
I swear they sound the same
It's like they know my skin
Every word they say sounds just like him
And it goes like this
[Chorus]
We'll get in your car and you'll lean to kiss me
We'll talk for hours and lie on the backseat
Uh-huh, uh-huh, uh
Uh-huh, uh-huh
And then one random night when everything changes
You won't reply and we'll go back to strangers
Uh-huh, uh-huh, uh
Uh-huh, uh-huh, uh"
share_video_7323262023205227809_.mp3,MANIAC,VIVIZ,"[비비지 ""MANIAC"" 가사]
[Verse 1: SinB,
Eunha
]
힘껏 내팽개친 roses, 말론 안 통하지
역시 어쩜 이리 안 변해
인정 같은 소린 됐고 이쯤에서 끝내, let go
인내심도 out of space
[Pre-Chorus: Umji]
(Ah-ah) 얼룩지는 red carpet
(Ah-ah) 그렇게 또 fade away
(Ah-ah) 치워줘, scarred face
끝까지 신경 쓰여
[Chorus: SinB,
Eunha
]
This love is maniac, maniac, maniac
But I can't killin' it, killin' it, killin' it
사랑 말고 다른 말론 설명할 수 없는 멜로
It's maniac, maniac, maniac
[Post-Chorus: Umji,
SinB
,
Eunha
]
(Ooh-ooh-ooh) 자극적 이끌림
(Ooh-ooh-ooh) 잔인해진 orbit
(Ooh-ooh-ooh)
지겨운 lovephobic, yeah
그래 솔직하자 넌 지금 즐긴 거야"
share_video_7329708546503740714_.mp3,Better Call Frank Again (Radio Edit),MR. LA FRANK THE CEO,This song is an instrumental
share_video_7322488180920372526_.mp3,Prada (Acoustic Version),"cassö, RAYE & D-Block Europe","[Verse 1: RAYE]
'Bout to take my lady Selfridges
New drip on the way, uh-huh
Still sellin' bricks
Half a cake on the way, uh-huh
Take a flight, she wanna take a Lyft
Phone the molly man, he's on the way, uh-huh
I might take her The Shard, I might take her The Ritz
It don't matter, baby, I'm straight, uh-huh
[Verse 2: RAYE]
I feel like I'm in Prince's house
Purple paint all on the walls, uh-huh
Sittin' down on this fancy couch
And I can't see straight, I'm a state, uh-huh
Twenty-two, I'm in Paris, baby
Got strippers tits in my face, uh-huh
Pull up in a Bentley, I want Christian, I want Fendi
[Chorus: RAYE]
I want Prada, ah-ah, ah-ah
Ooh-ooh, ooh-ooh-ooh
I want Prada, ah-ah, ah-ah
Ooh-ooh, ooh-ooh-ooh
I already make that paper, I don't need to chase no clout, wow
I don't usually pipe up, but I don't like how you runnin' your mouth, wow
You a side piecе from east, then I'm a bad bitch from south, wow
I already makе that paper, I don't need to chase no clout, wow
I don't usually pipe up, but I don't like how you runnin' your mouth, wow
You a side piece from east, then I'm a bad bitch from south, wow
Baby, baby, I got more money comin' in than goin' out
Yeah-"
share_video_7323234059495165227_.mp3,Open Arms (feat. Travis Scott) [Mixed],SZA,"[Intro: Norma Rowe]
When
you do your best you ca—, I done told you
When you do your best, hell, that's all you can do
You and me and anybody else
So they always start talkin'
[Verse 1: SZA]
Runnin' away from where I'm from
Never can stay with no one
Lovin' you almost feels like something
When no one's around me
You lost and found me
I was surrounded
With open, open, open
[Chorus: SZA &
Travis Scott
]
Open arms (
Ooh
)
Open arms
You keep me open, I'm so devoted
You keep me open (
Ooh
)
Open arms
I'm so devoted to you, to you, to you
[Verse 2: SZA]
Spent your life bein' hopeless
Chokin' on insecurity
I know ownership's bad
But please put a leash on me anyway
Who needs self-esteem anyway?
I hate myself to make you stay
Push me away, I'll be right here
With open, open, open"
share_video_7323369741996002566_.mp3,Heart of Glass,Blondie,"[Verse 1]
Once I had a love and it was a gas
Soon turned out had a heart of glass
Seemed like the real thing, only to find
Mucho mistrust, love's gone behind
[Verse 2]
Once I had a love and it was divine
Soon found out I was losing my mind
It seemed like the real thing but I was so blind
Mucho mistrust, love's gone behind
[Chorus]
In between, what I find is pleasing and I'm feeling fine
Love is so confusing, there's no peace of mind
If I fear I'm losing you, it's just no good
You teasing like you do
[Instrumental Bridge]
[Verse 1]
Once I had a love and it was a gas
Soon turned out had a heart of glass
Seemed like the real thing, only to find
Mucho mistrust
, love's gone behind"
share_video_7327142848485231914_.mp3,Dangerously in Love 2,Beyoncé,"[Intro]
I love you
I love you
I love you
[Verse 1]
Baby, I love you, you are my life
My happiest moments were incomplete if you weren't by my side (You weren't by my side)
You're my relation, in connection to the sun (Connection to the sun)
With you next to me, there's no darkness I can't overcome (I can't overcome)
You are my raindrops, I am the seed (I am the seed)
With you and God, who's my sunlight, I bloom and grow so beautifully (Grow so beautifully)
Baby, I'm so proud, proud to be your girl (Proud to be your girl)
You make the confusion go all away from this cold and messed up world
[Chorus]
I am in love with you (In love), you set me free
I can't do this thing called life without you here with me
'Cause I'm dangerously in love with you (In love), I'll never leave
Just, just keep lovin' me the way I love you, lovin' me
'Cause I am in love with you (In love), you set me free
I can't do this thing called life without you here with me
'Cause I'm dangerously in love with you (In love), I'll never leave
Just keep lovin' me the way I love you, lovin' me
[Verse 2]
And I know you love me, love me for who I am (Love me for who I am)
'
Cause years before I became who I am, baby, you were my man (Baby, you were my man)
I know it ain't easy, easy lovin' me (Easy lovin' me)
I appreciate the love and dedication from you to me (From you to me)
Later on in my destiny, I see myself having your child (I see myself having your child)
I see myself being your wife and I see my whole future in your eyes (Future in your eyes)
The thought of all my love for you sometimes makes me wanna cry (Sometimes makes me cry)
I realize all my blessings, I'm grateful to have you by my side"
share_video_7325872750529252654_.mp3,That's My Best Friend,Tokyo Vanity,"[Hook]
Cause my best friend finna, she finna
Ooh, go best friend
That's my best friend, that's my best friend, (yas)
(That's my best friend, that's my best friend)
You better fuck it up, best friend won't you?
(Come on best friend, let's go)
Won't you, won't you? Throw it in a circle, Yas
(Oh, oh, turn up)
Cause my best friend finna, she finna
(That's my best friend) Ooh, go best friend
That's my best friend, that's my best friend (yas)
(That's my best friend, that's my best friend)
You better fuck it up, best friend won't you?
Won't you, won't you? Throw it in a circle, yas
[Verse 1]
Uh Uh
The baddie over there with the Brazilian hair
Turned up in the club, that's my best friend
The one that your man looking at, the one that you can't stand (yup)
Like Gina and Pam I'm the right, she the left hand
You looking at my best friend, you know I'm like ""What's up?"" (What's up?)
Behind my best friend, you know I'm gonna turn up
So don’t get buck, cause you will get
snuck
Cause you already know what it is with us
Best friend you better work (let's go) dip it low (that's my best friend), twerk
Got on that mini skirt (you better) twerking it like it’s finna hurt (fuck it up)
Best friend, I just can't take it (oh, oh, oh, oh)  the way that ass shaking
Got these niggas feeling wavy,  and these bitches (Hol' Up, Hol' Up, that's my best friend) sideline hating"
share_video_7321892334558301446_.mp3,Praise Jah In the Moonlight,YG Marley,"[Intro: Bob Marley]
They say the sun shines for all
But in some people world, it never shine at all
[Chorus: YG Marley]
These roads of flames are catching on fire
Ah, ah, ah, ah-ah-ah
Showed you I loved you, you called me a liar
Oh, no-no, no, no, no
[Verse 1: YG Marley]
Baby, tell me where you gone, gone, gone?
I've been fiendin' for your love so long
We can praise Jah in the moonlight
Baby, if you with me, better do right
And I've been gone too long
And I'm hoping that you sing my songs (Sing my songs)
I've been on this road for way too long
I've been hoping that we all get along
[Chorus: YG Marley]
These roads of flames are catching on fire
Ah, ah, ah, ah-ah-ah
Showed you I loved you, you called me a liar
[Verse 2: YG Marley]
Give Jah the thanks and praises
I've been on my own, own, own
But we ain't never left alone, 'lone, 'lone
And if I'm tellin' you the feeling is wrong
Relax a little, friend, this won't take too long
And when you're feeling alone
You can call my phone
Is there a better way to go?
Teach them something before they lose their soul
Oh, no-no, no, freedom is the road
Oh, no-no, no, coming in from the cold
Tell them not to sell it, it's worth more than gold
And guiltiness will catch them in the end
Oh yeah, oh yeah
They'll try to manipulate you through your pockets
Ah, ah, ah, ah-ah-ah
Now you're gonna bring the funk with the optic, with the vision
Ah, ah, ah, ah-ah-ah
Trying to control your soul and take control (Oh, no-no, no)
Ah, ah, ah, ah-ah-ah
No we don't play that game right here to win power
Ah, ah, ah, ah-ah-ah"
share_video_7327889338442714411_.mp3,Young and Beautiful,Lana Del Rey,"[Verse 1]
I've seen the world, done it all
Had my cake now
Diamonds, brilliant,
and Bel Air now
Hot summer nights, mid-July
When you and I were forever wild
The crazy days, city lights
The way you'd play with me like a child
[Chorus]
Will you still love me when I'm no longer young and beautiful?
Will you still love me when I got nothing but my aching soul?
I know you will, I know you will, I know that you will
Will you still love me when I'm no longer beautiful?
[Verse 2]
I've seen the world, lit it up as my stage now
Channeling angels in the new age now
Hot summer days
, rock and roll
The way you'd play for me at your show
And all the ways I got to know
Your pretty face and electric soul
[Chorus]
Will you still love me when I'm no longer young and beautiful?
Will you still love me when I got nothing but my aching soul?
I know you will, I know you will, I know that you will
Will you still love me when I'm no longer beautiful?"
share_video_7332151913791786286_.mp3,Como La Flor,Selena,"[Letra de ""Como La Flor""]
[Verso 1]
Yo sé que tienes un nuevo amor
Sin embargo, te deseo lo mejor
Si en mí no encontraste felicidad
Tal vez alguien más te la dará
[Coro]
Como la flor (Como la flor)
Con tanto amor (Con tanto amor)
Me diste tú, se marchitó
Me marcho hoy, yo sé perder
Pero, a-a-ay, cómo me duele
A-a-ay, cómo me duele
[Verso 2]
Si vieras como duele perder tu amor
Con tu adiós te llevas mi corazón
No sé si pueda volver a amar
Porque te di todo el amor que pude dar
[Coro]
Como la flor (Como la flor)
Con tanto amor (Con tanto amor)
Me diste tú, se marchitó
Me marcho hoy, yo sé perder
Pero, a-a-ay, cómo me duele
A-a-ay, cómo me duele
Como la flor (Como la flor)
Con tanto amor (Con tanto amor)
Me diste tú, se marchitó
Me marcho hoy, yo sé perder
Pero, a-a-ay, cómo me duele
A-a-ay, cómo me duele
A-a-ay, cómo me duele"
share_video_7335581309290515744_.mp3,CLEARED - Remix,Lilithzplug,"[Intro]
(
I'll do it, you lazy bitch
)
[Chorus]
Fuck it, let's go
Take it real slow
Take it real slow
Take it real slow
Fuck it, let's go
Take it real slow
Take it real slow
Take it real slow
[Verse]
Watch how I walk
Watch how I talk
Watch how I vogue down on the floor
On the floor
Only one can be crowned
Fuck how you feel
As long as I clear the room, the room
Ain't nobody clearin' nothin'
Ain't nobody stealin' nothin'
Away from me
Away from me
You can strut across the floor
Let your hair hang down some more
Just for me
Just for me"
share_video_7315604666065194245_.mp3,FTCU (Mixed),Nicki Minaj,"[Intro: Waka Flocka Flame,
Nicki Minaj
&
Future
]
Fuck this club up, fuck this, fuck this club up (Flocka)
Fuck this club up, fuck this, fuck this club up (Flocka)
Fuck this club up, fuck this, fuck this club up (Flocka)
(
ATL Jacob, he a fuckin' millionaire
)
Yeah
Fuck this club up, fuck this, fuck this club up (
Yeah, yeah, yeah, yeah
; Flocka)
Fuck this club up, fuck this, fuck this club up (
Yeah, yeah, yeah
; Flocka)
Fuck this club up, fuck this, fuck this club up (
Yeah, yeah, yeah
; Flocka)
Fuck this club up, fuck this, fuck this club up (Flocka)
[Verse 1: Nicki Minaj]
Ayo, I tell 'em that I'm the Sleeze, they tellin' me, ""Okay, prove it""
I leave these bitches on read, so now they know that they blew it
I tell 'em I'm movin' units, my videos, they gon' view it
Spotify ain't gotta lie, they really streamin' my music (Woo)
I give bitches the crown, thеy fuck around and lose it, nah
I am the wave, I only wavе when I'm tellin' 'em bye
Bitch, we ain't twinnin', ain't fraternal or identical
When I'm around, bitch, you know you become invisible
[Refrain: Nicki Minaj]
Mm, who wanna play with Nicki?
Got the power, I could tell my niggas, ""Spray like 50""
(Brr)
Come on, bitch, I just put a milli' on my Richie
Minus like fifty, mine was nine-fifty, sissy"
share_video_7329541169803824417_.mp3,Shootout (Sped Up),Izzamuzzic & Julien Marchal,"[Verse]
Who was the girl that was on your side?
I was the girl who was on your side
Who was the girl that was on your side?
I was the girl who was on your side
There was that girl who was on your side
I was the girl who was on your side
There was that girl who was on your side
I was the girl who was on your side
There is a girl who was on your side
I was the girl who was on your side
[Instrumental Break]
[Verse]
There is a girl who was on your side
I was the girl who was on your side
There was that girl who was on your side
I was that girl who was on your side
There is a girl who was on your side
I was the girl who was on your side
There is a girl who was on your side
I was the girl who was on your side
Thеre is that girl who was on your side
I was the girl who was on your sidе"
share_video_7317174577438788895_.mp3,Hier Encore,Charles Aznavour,"[Paroles de ""Hier encore""]
[Couplet 1]
Hier encore, j'avais vingt ans
Je caressais le temps, et jouais de la vie
Comme on joue de l'amour, et je vivais la nuit
Sans compter sur mes jours, qui fuyaient dans le temps
J'ai fait tant de projets, qui sont restés en l'air
J'ai fondé tant d'espoirs, qui se sont envolés
Que je reste perdu, ne sachant où aller
Les yeux cherchant le ciel, mais le cœur mis en terre
[Couplet 2]
Hier encore, j'avais vingt ans
Je gaspillais le temps, en croyant l'arrêter
Et pour le retenir, même le devancer
Je n'ai fait que courir, et me suis essoufflé
Ignorant le passé, conjuguant au futur
Je précédais de moi toute conversation
Et donnais mon avis, que je voulais le bon
Pour critiquer le monde, avec désinvolture
[Couplet 3]
Hier encore, j'avais vingt ans
Mais j'ai perdu mon temps à faire des folies
Qui ne me laissent au fond rien de vraiment précis
Que quelques rides au front, et la peur de l'ennui
Car mes amours sont mortes, avant que d'exister
Mes amis sont partis, et ne reviendront pas
Par ma faute j'ai fait le vide autour de moi
Et j'ai gâché ma vie, et mes jeunes années"
share_video_7343322187715300654_.mp3,Tadow,Masego & FKJ,"[Intro]
Yeeah, ooh, yeh
Ayy, ayy, ayy, oh, ahh
Ayy, ayy, ahh, ahh
Tadow
Ayy, ayy, ay, oh, ahh
Ayy, ayy, ahh, ahh
Tadow
[Verse 1]
I saw her and she hit me like (Tadow)
Saw that thing so beautiful (Tadow)
She just hit my heart, oh (Tadow)
Full force and she got me like (Tadow)
[Pre-Chorus]
I be like (Tadow) Baby (Tadow)
Why you so fine? (Tadow, tadow)
Gotta make you mine (Tadow, tadow)
So hard to find (Tadow, tadow)
[Verse 2]
Baby like oh, how'd you do the thing?
The way that you do it and she ain't even show, nothing
She be walking round so confident, so heaven-sent"
share_video_7342383300700491054_.mp3,CARNIVAL (feat. Playboi Carti),"¥$, Kanye West, Ty Dolla $ign & Rich The Kid","[Intro: Choir &
Playboi Carti
]
Go, go, go, go
Head so good, she a honor roll
She ride the dick like a carnival
I done did the impossible
Go, go, go, go
Head so good, she a honor roll
She ride the dick like a carnival
I done did the impossible
Go
Ha, ha, ha,
schyeah
[Verse 1: Rich The Kid &
Playboi Carti
]
Way too rich to drive a Rove'
Made a milli' off the stove
She like to put it in her nose
Pretty bitch with white toes
I done put on all the bros
I done fucked her in the Rolls (
Hahahaha
)
I done pulled up in the Ghost
I done reachеd all my goals
Yeah, yeah, pull up with Yeezy and Dolla $ign
I'm all about business, I'm mindin' minе
Pull up in the trenches like Columbine
Pull up with the rocket like NumbaNine
I don't want your hoes
Young nigga reach all the goals
Let her suck the dick, said she was a pro
If she scrape her teeth, I'ma tell her to go"
