file_name,track_name,artist,lyrics
share_video_7329274198096973099_.mp3,Montagem Mysterious Game,LXNGVX,This song is an instrumental
share_video_7339685917759769899_.mp3,Dumptruck,Kinfolk Thugs,"[Intro]
Ah-where they at?
(K-K-K-Kin Folk Thugs)
(Hey, hey) I love the way you work it
(Hey, hey) I love the way you work it
Right about now
(Hey, hey) I love the way you work it
This where all the fine ladies take the floor
(Hey, hey) I 'm talkin' 'bout that dump truck
Let me see that dump truck, baby
(
Hey, ladies
)
Now, don't worry bout' it, some dump trucks bigger than others
(
You, you drive me crazy
) It ain't the size of that thang
It's how you dump that dump truck
You know what I'm talkin' 'bout?
[Chorus]
I'm talkin' 'bout that dump truck (C'mon)
Now back it up and dump it (
Hey, ladies
)
Back it up and dump it on me
Back it up and dump it
Back it up and dump it on me
Back it up and dump it
(
You, you drive me crazy
)
Back it up and dump it on me
Back it up and dump it
I'm talkin' 'bout that dump truck"
share_video_7324083003284573482_.mp3,Little Life,Cordelia,"[Verse 1]
How would you have me described?
With light?
With words you think that I'd like?
If I found out that I could flight
Would I take you out tonight?
[Pre-Chorus]
A little bit more, a little bit less
A little bit harder than I thought they said
A little bit fine, a little bit stressed
A little bit older than I thought I'd get
But I
[Chorus]
I think I like this little life
This little life
I think I like this little life
This silly little life
[Verse 2]
Eyes, smiling over candles
Mismatched chairs
Arms crossing where those hands go
It's loud, but that volume makes my heart glow
And time isn't real as the sun goes
Oh, oh, oh"
share_video_7303373812387679490_.mp3,"A Sky Full of Stars (Live at the Royal Albert Hall, London)",Coldplay,"[Intro]
Oh, turn the lights on, turn the lights on yeah, turn the lights on
Oh, let's go, yeah, yes
[Verse 1]
'Cause you're a sky, 'cause you're a sky full of stars
I'm gonna give you my heart
'Cause you're a sky, 'cause you're a sky full of stars
And 'cause you light up my path, oh
[Chorus]
And I don't care, go on and tear me apart
I don't care if you do, ooh-ooh, oh
'Cause in a sky, 'cause in a sky full of stars
I think I saw you, ooh-ooh-ooh, ooh-ooh-ooh
Let's go, one, two, three, go!
[Verse 2]
'Cause you're a sky, 'cause you're a sky full of stars
I wanna die in your arms, oh, oh-oh, oh
'Cause you get lighter the more it gets dark
I'm gonna give you my heart, oh
[Chorus]
And I don't care, go on and tear me apart
I don't care if you do, ooh-oh, oh
'Cause in a sky, 'cause in a sky full of stars
I think I saw you, ooh-ooh-ooh, ooh-ooh-ooh
I think I saw you, ooh-ooh-ooh, ooh-ooh-ooh
One, two"
share_video_7306351228974288159_.mp3,How To Never Stop Being Sad,dandelion hands,"Repeat to yourself that they're not really gone
Time has proven that fooling yourself into believing a lie is the most effective way to deal with things you have no control over
Keep listening to the mixtapes they made you
Overanalyze every single word you hear
""Was this a sign that things were going wrong?""
No, no, you were the one who cared too hard, not them
Stay up every single night staring at your phone
Either attempting to gather up the courage to turn these demons
These constant reminders of your loneliness into nothing more than a bad dream
Or praying just for one second you could feel the warmth of equally returned love
Go out for coffee four times a week by yourself
Always bring your notebook, never stop writing
Leave little comics and thank you notes with your tip
Watch them smile as you get in your car
Talk down on yourself whenever possible
""My life is shit because I deserve it, right?""
You must have done something really bad;
It's nearly impossible for you to cry now
Avoid your friends for weeks even though they're the only sense of consistency you have left in your life
If they really wanted to see you, they'd come, but they won't
Who cares?"
share_video_7341080338803821866_.mp3,How To Press a Pill,Punchmade Dev,"[Intro]
Drug use in Kentucky is on the rise according to a new study by Millennium Health
The state ranks number one for percentage of fentanyl-positive drug tests in 2019
Fentanyl use often coincides with heroin, cocaine, or meth use in Kentucky, according to Millennium Health
[Verse]
Should I rap or should I stick to my addiction?
Should I trap or should I keep punchin' in credit card digits?
I'm trying to find another fiend, I'm in the kitchen
I got too many options, all of them come with a sentence
I heard they said the police on my trail, but I'm still livin' free (Where they at?)
Long live Heather, I'm a pill legend, I let her live through me
I think it's time for me to start givin' out pills for free
Here go a fake pill for you, I'm keepin' the real ones for me
I'll backdoor my own mans, don't be playing with me
In my traphouse, I got a couple fiends stayin' with me
It make it easier for me to make them get paper to me
I can show you how to make a mil' off pills, I'll tell you for free (Come on)
First, you want to get a real bag of Percocets
Pour them on a table, spread it out, see what you workin' with
This probably ain't for you if you ain't never seen or heard of it
You gon' have a couple hiccups, long live Heather, she's a murder kit
Okay, once you get the pills, you need Fentanyl
It's okay if you're running low on pills, we finna stretch them all
This the play, gather up all of the pills, we finna crush them all
If you're greedy, you can triple cut the pills like me, I need it all
Let me guess, you forgot to buy the pill presser?
Grab a piece to go punch it off Amazon 'cause the shipping is better
Grab a good one unless you don't care to make a new Heather
I'm tryna tear a happy family down, I can kill them together
Wear gloves, you gotta make sure you keeping it clean
Grab the Percocets and Fentanyl, put it in the machine, press the pill down and
stamp the M, get it right for the fiends
When you finish that, go to the hood, but don't start a big scene
Make sure they're dressed up like a bum, so you fit in the hood
Once you get clientele, start paying fiends to make sure that it's good
Tell them be a lookout because the police be all in the hood
Give a couple of samples out for free
They come back when it's good, but they can't come back when they dead
I got a strange addiction, I get really excited when they dead
I don't know where I would be at if I wasn't selling meds
Never mind, I'd probably be somewhere scamming, laying in bed"
share_video_7339691972225010975_.mp3,CARNIVAL (feat. Playboi Carti),"¥$, Kanye West, Ty Dolla $ign & Rich The Kid","[Intro: Choir &
Playboi Carti
]
Go, go, go, go
Head so good, she a honor roll
She ride the dick like a carnival
I done did the impossible
Go, go, go, go
Head so good, she a honor roll
She ride the dick like a carnival
I done did the impossible
Go
Ha, ha, ha,
schyeah
[Verse 1: Rich The Kid &
Playboi Carti
]
Way too rich to drive a Rove'
Made a milli' off the stove
She like to put it in her nose
Pretty bitch with white toes
I done put on all the bros
I done fucked her in the Rolls (
Hahahaha
)
I done pulled up in the Ghost
I done reachеd all my goals
Yeah, yeah, pull up with Yeezy and Dolla $ign
I'm all about business, I'm mindin' minе
Pull up in the trenches like Columbine
Pull up with the rocket like NumbaNine
I don't want your hoes
Young nigga reach all the goals
Let her suck the dick, said she was a pro
If she scrape her teeth, I'ma tell her to go"
share_video_7326288796163607841_.mp3,"yes, and",Ariana Grande,"[Verse 1]
In case you haven't noticed
Well, everybody's tired
And healin' from somebody
Or somethin' we don't see just right
[Pre-Chorus]
Boy, come on, put your lipstick on (No one can tell you nothin')
Come on and walk this way through the fire (Don't care what's on their mind)
And if you find yourself in a dark situation
Just turn on your light and be like
[Chorus]
""Yes, and?""
Say that shit with your chest, and
Be your own fuckin' best friend
Say that shit with your chest
Keep moving like, ""What's next?""
""Yes, and?""
[Verse 2]
Now, I'm so done with caring
What you think, no, I won't hide
Underneath your own projections
Or change my most authentic life"
share_video_7330409084144979243_.mp3,We Are the People (Burns Remix),Empire of the Sun,"We can remember
Swimming in December
Heading for the city lights
In nineteen seventy five
We share in each other
Nearer than farther
The scent of a lemon
Drips from your eyes
We are the people that rule the world
A force running in every boy and girl
All rejoicing in the world
Take me now, we can try
We lived an adventure
Love in the summer
Followed the sun till night
Reminiscing other times of life
For each every other
The feeling was stronger
The shock hit eleven
Got lost in your eyes
I can't do well when I think
You're gonna leave, but I know I try
Are you gonna leave me now?
Can't you be believing now?"
share_video_7339621873120021791_.mp3,Blooket Freestyle Beat,cj icyy,This song is an instrumental
share_video_7336557059963374890_.mp3,Hot X So Much Hype,Tre Savage,"W's in the shot W's in the shot ladies
with gentle
hands I
type um I do it I do
it ladies with
gentle re tired from only
F your chance come get
your got what I like hey I do it I do it
I do it I do it my Ty I do it I do it I
do it I do it right I do it I do it I do
it I do it my I do it I do it I do it I
do
it I'm jumping in
noes cooking up the a
reservation these caramel nut I'm let it
taste
them showing off the money that I get
chasing you got the best body trust me
and I want you
obviously one time can you not be
fussing can you not be fussing
now put gentle hands to my soul my urg
is losing control she dripped in glitter
and Golding you up when this SN and cold
in the bed my body see gentle hands Me
Softly let get off me ladies with the
gentle
hand re tired from only
F here your chance come get
your got what I like hey I do it I do it
I do it I do it just my I do I do it I
do I do
it I do I do it I do I do
it I do I do it I do it I do
it does in the chat does in your
panties cleaning your inside sco
nties girl I'm your drug
toties I'm sleeping over so I brought my
Jamies seen her the grams give me your
hands cuz they smoother than butter I
can I lose her I love her Rob but I'm
using a rubber we both under the cover
she wants to move in with each other I
don't care what the cases your booty
I'mma chase this doing you on a regular
basis a king and a queen we be greatness
loveing your
seductiveness your touch got me up in
Bliss CL when we hugging kid should be
cuing
this ladies with the gentle
hands retired from only
F here's your chance come get
your got what I like hey I do it I do it
I do it I do it just my type I do it I
do it I do it I do it all right I do it
I do it I do it I do it my I do it I do
it I do it I do it"
share_video_7324762050549402912_.mp3,Ribs,Lorde,"[Verse 1]
The drink you spilt all over me
""Lover's Spit"" left on repeat
My mum and dad let me stay home
It drives you crazy, getting old
[Pre-Chorus]
We can talk it so good
We can make it so divine
We can talk it good
How you wish it would be all the time
[Chorus]
The drink you spilt all over me
""Lover's Spit"" left on repeat
My mum and dad let me stay home
It drives you crazy, getting old
The drink you spilt all over me
""Lover's Spit"" left on repeat
My mum and dad let me stay home
It drives you crazy, getting old
[Verse 2]
This dream isn't feeling sweet
We're reeling through the midnight streets
And I've never felt more alone
It feels so scary, getting old"
share_video_7322986923369319713_.mp3,Grey,Yung Filly,"[Verse 1]
Simmer down, Mami, simmer down
Didn't know you need it now, Mami
I'm in it now, watch me turn into a pound, Mami
A million pound, this kind of flow ain't written down, Mami
I know, I know, I know, I need her, need her
But I'm sorry, I can't take you for a keeper
So it's lookin' like we need a separation
I'm doing road so I can't do no obligation
Still goin' through the rain, I've seen some thunders
Let's take a look, see a feed full of busters
You cannot teach me nothin', I'm a hustler
Another portion of cake with the custard
And I be waved with this Rémy on a boat
I think you might like, I'm feelin' myself
I already fly high
Girl, it's the way it's envisioned, my mind, my mind
[Chorus]
Feels like I'm on a wave (Feel like I'm on a wave)
How come I see the colour grey? (How come?)
Calm now, we are not thе same
Found nothin' on my name
[Verse 2]
Simmer down, Mami, simmеr down
VVS's swimmin' round on me, they swimmin' round
I'm in and out the globe because I got a pound to spend (Oh, yeah)
Took a private jet right out the ends (Ah)
I know, I know, I know you fell in love with this
But did you fall for me or this life? (Or this life, oh)
I know, I know, I know you get a buzz from this
But are you gonna be here all the time?
So what's the matter? What's the situation?
If it wasn't for the moolah, would you still be vacant?
Would you hold me down or have me looking for replacement?
Bought a crib for my mama, I need one adjacent (Adjacent)
Can't talk to me, you need to hit my agent
Depo want a house, I put that on a bracelet
You can have one matching, you just need to know arrangements
Said ""I love you,"" that weren't entertainment"
share_video_7341100174393085226_.mp3,Untitled #13 (Super Slowed),glwzbll,This song is an instrumental
share_video_7339616299145923886_.mp3,ICEWHORE! (slowed),Lumi Athena,"バイバイ！
[Instrumental]
バイバイ！
[Instrumental]
この子一人で十分よ
勝ち！勝ち！"
share_video_7331320026718326048_.mp3,(Did Somebody Say) Just Eat,Katy Perry,"[Intro]
Did somebody say Just Eat?
Ding-dong
,
ring-a-ding-ding-ding-dong
Did somebody say Just Eat?
[Verse 1]
Want my curry in a hurry (Medium spice)
Extra sauce on the low (Boo won't know)
And I want
açai
Yeah, yeah, yeah, when I'm ordering delivery
[Verse 2]
A little sushi while I watch a movie
Papaya salad while I sing a ballad
Need some ice cream, make it a swirl
Gotta treat this California girl
[Pre-Chorus]
When you're running low, there's only one place to go
'Cause I get what I want, when I want it (When I want it)
Margherita with extra cheese on it
Download, now all I gotta do is pull out my phone
Easy: One, two, three
Mocha-whip triple-shot,
it means a latte to me
[Chorus]
Did somebody say Just Eat?
Ding-dong
,
ring-a-ding-ding-ding-dong
Did somebody say Just Eat?
Ding-dong
,
ring-a-ding-ding-ding-dong
Did somebody say Just Eat?"
share_video_7325165757166325035_.mp3,Bow Bow Bow (F My Baby Dad),Sexyy Red,"[Intro]
(
Tay Keith, fuck these niggas up
)
Fuck my baby dad, fuck my baby dad, fuck my baby dad
I'm a fine-ass bitch, I ain't in the house sad (Sexyy)
Fuck my baby dad
[Chorus]
(Baow, baow, baow, baow, baow) That's that booty meat
(Ayy, ayy, ayy, ayy, ayy) Look at them booty cheeks
(Baow, baow, baow, baow, baow) That's that booty meat
(Ayy, ayy, ayy, ayy, ayy) Look at them booty cheeks
[Verse 1]
All that ass on her, damn, this bitch bad
Switch my hips when I walk, yeah, I know you like that (It's Sexyy)
My nigga fucked up, fuck my baby dad
I'm gettin' outside, I ain't in the house sad (No)
Called up my bitch, we finna go out (Yeah)
Where the niggas at? It's lookin' like a drought (Damn)
My mama got the kids, I'm gettin' out this house
All in the club bouncin' ass, showin' out (Northside)
Lip-gloss poppin', bitch, I'm show-stoppin' (Mwah)
Lookin' like a snack, baby daddy cock blockin' (Hatin'-ass nigga)
Turnt up to the max, I'm the trendin' topic
My nigga actin' up, so you know I'm finna pop it"
share_video_7323996683619044613_.mp3,Cupid's Chokehold (Featuring Patrick Stump),Gym Class Heroes,"[Intro: Patrick Stump]
Mbabarara, mbabarara
Mbabarara, mbabarara, mbabarara
[Chorus: Patrick Stump]
Take a look at my girlfriend
She's the only one I got (Mbabarara)
Not much of a girlfriend
I never seem to get a lot (Mbabarara, mbabarara)
[Verse 1: Travie McCoy]
It's been some time since we last spoke
This is gonna sound like a bad joke
But Momma, I fell in love again
It's safe to say I have a new girlfriend
And I know it sounds so old
But Cupid got me in a chokehold
And I'm afraid I might give in
Towel's on the mat, my white flag is wavin' (Mbabarara)
I mean, she even cooks me pancakes
And Alka-Seltzer when my tummy aches
If that ain't love then I don't know what love is
We even got a secret handshake
And she loves the music that my band makes
I know I'm young, but if I had to choose her or the sun
I'd be one nocturnal son of a gun (Mbabarara, mbabarara)"
share_video_7339669741881150752_.mp3,New Home (Slowed),Austin Farwell,This song is an instrumental
share_video_7337667085163613445_.mp3,What You Won't Do for Love,Bobby Caldwell,"[Verse 1]
I guess you wonder where I've been
I searched to find a love within
[Refrain]
I came back to let you know
Got a thing for you and I can't let go
[Verse 2]
My friends wonder what is wrong with me
Well, I'm in a daze from your love, you see
[Refrain]
I came back to let you know
Got a thing for you and I can't let it go
[Pre-Chorus]
Some people go around the world for love
But they may never find what they dream of
[Chorus]
What you won't do, do for love
You've tried everything, but you don't give up
In my world, only you
Make me do for love what I would not do"
share_video_7326842376004111646_.mp3,Murder On the Dancefloor,Sophie Ellis-Bextor,"[Intro]
(Murder, murder, murder…)
It's murder on the dancefloor
But you better not kill the groove
DJ, gonna burn this goddamn house right down
[Verse 1]
Oh, I know, I know, I know, I know, I know, I know, I know
About your kind
And so, and so, and so, and so, and so, and so, and so
I'll have to play
[Pre-Chorus]
If you think you're getting away, I will prove you wrong
I'll take you all the way, boy, just come along
Hear me when I say, hey
[Chorus]
It's murder on the dancefloor
But you better not kill the groove, hey-hey, hey-hey
It's murder on the dancefloor
But you better not steal the moves
DJ, gonna burn this goddamn house right down
[Verse 2]
Oh, I know, I know, I know, I know, I know, I know, I know
I know there may be others
And so, and so, and so, and so, and so, and so, and so
You'll just have to pray"
share_video_7325167054196051246_.mp3,Sweetest Pie (David Guetta Dance Remix Extended),"Megan Thee Stallion, Dua Lipa & David Guetta","[Intro: Dua Lipa]
You've never been to Heaven, have you?
[Chorus: Dua Lipa &
Megan Thee Stallion
]
Ooh, this the ride of your life
Hold on 'cause, baby, I might
I might just give you a bite of the sweetest pie (
Yeah, yeah, yeah, ah
)
Ooh, baby, we can go fast
I'll drive and you just lay back
I got the flavour that lasts, yeah, the sweetest pie (
Uh-huh, uh-huh
)
I might take you home with this, I might give you all of it (
Yeah
)
Come get your dose of the sweetest pie
Ooh, this the ride of your life
Hold on 'cause, baby, I might
I might just give you a bite of the sweetеst pie (
Uh-huh, uh-huh
)
[Verse 1: Megan Thee Stallion]
Baby, I'm the sweetest, pussy is thе meanest (Yeah)
Hot girl shit, but I'm cold every season (But I'm)
Know he got that pipe, let him bust it 'til it's leakin' (Yeah, mwah)
Booty like a pillow, he can use it while he's sleepin' (Look)
Don't be goin' through my phone 'cause that's the old me (Old me)
Ain't the only one tryna be my one and only (Tryna)
Real thick, movin' slow, that body like codeine
He a player, but for Megan, he cuttin' the whole team (Hey, hey, hey, hey)
That body lookin' nice (Lookin' nice)
I got cake and I know he want a slice
I wish a nigga would try to put me on ice (Brrr)
I ain't never had to chase dick in my life (Dick in my life)
I like that nasty, that freaky stuff (Freaky stuff)
Slip under my bed and keep me up (Hey)
That Hansel and Gretel, let him eat me up (Ah)
Uh, uh, uh, uh, uh"
share_video_7324381104893349166_.mp3,First Love,Oscar Ortiz & Edgardo Nuñez,"[Letra de ""First Love""]
[Verso: Oscar Ortiz]
Desde esa noche me dejaste derrotado
No sé qué hiciste que no me he curado
Ya llevo meses y no te he olvidado
Tú me dañaste y lo has aceptado
[Pre-Coro: Edgardo Nuñez]
Ahí voy de tonto recordando y nunca paro
Siempre lo mismo, solito me daño
Ya que te fuiste, cómo he madurado
Sé que es muy tarde, no estás a mi lado
Cómo quisiera tenerte a mi lado, woh-woh, woh-woh, woh
[Coro: Oscar Ortiz &
Edgardo Nuñez
]
Yo quisiera saber lo que sientes, a vеr
Explícame una vez
¿Yo qué te hicе a ti pa' que pongas el fin en esta relación?
Solo tú, solo tú, solo tú
Admito que he llorado
Pienso en ti, pienso en ti, pienso en ti
Sabiendo que yo no fui el malo
Tú me dejaste y yo no fui el malo
En mi cumpleaños, cómo me has dañado
¿En qué pensabas si nunca fui malo?
Solo te fuiste y me dejaste derrotado
, woh-oh, woh-oh, woh-oh"
share_video_7337902986385050922_.mp3,Goth,Sidewalks and Skeletons,"[Intro]
Place me, place me
Place me in my casket
[Chorus]
Place me in my casket tonight
Because I'm already dying inside
Pale skin so cold to the touch
Like a rose in bloom when we blush
Dark eyes meet under the sky
The stars are out, we're alive in the night
My hollow heart finds it too hard to trust
We're all alone until we turn back to dust
[Outro]
Place me, place me
Place me in my casket
Place me, place me
Place me in my casket
Place me, place me
Place me in my casket
Place me, place me
Place me in my casket"
share_video_7319628398270188833_.mp3,Ladies With Gentle Hands,Dubskie,"W's in the shot W's in the shot ladies
with gentle
hands I
type um I do it I do
it ladies with
gentle re tired from only
F your chance come get
your got what I like hey I do it I do it
I do it I do it my Ty I do it I do it I
do it I do it right I do it I do it I do
it I do it my I do it I do it I do it I
do
it I'm jumping in
noes cooking up the a
reservation these caramel nut I'm let it
taste
them showing off the money that I get
chasing you got the best body trust me
and I want you
obviously one time can you not be
fussing can you not be fussing
now put gentle hands to my soul my urg
is losing control she dripped in glitter
and Golding you up when this SN and cold
in the bed my body see gentle hands Me
Softly let get off me ladies with the
gentle
hand re tired from only
F here your chance come get
your got what I like hey I do it I do it
I do it I do it just my I do I do it I
do I do
it I do I do it I do I do
it I do I do it I do it I do
it does in the chat does in your
panties cleaning your inside sco
nties girl I'm your drug
toties I'm sleeping over so I brought my
Jamies seen her the grams give me your
hands cuz they smoother than butter I
can I lose her I love her Rob but I'm
using a rubber we both under the cover
she wants to move in with each other I
don't care what the cases your booty
I'mma chase this doing you on a regular
basis a king and a queen we be greatness
loveing your
seductiveness your touch got me up in
Bliss CL when we hugging kid should be
cuing
this ladies with the gentle
hands retired from only
F here's your chance come get
your got what I like hey I do it I do it
I do it I do it just my type I do it I
do it I do it I do it all right I do it
I do it I do it I do it my I do it I do
it I do it I do it"
share_video_7338769181594127622_.mp3,Habits (Stay High),Tove Lo,"[Intro]
Oh-oh, oh-oh, oh-oh
[Verse 1]
I eat my dinner in my bathtub, then I go to sex clubs
Watchin' freaky people gettin' it on
It doesn't make me nervous, if anything, I'm restless
Yeah, I've been around and I've seen it all
I get home, I got the munchies, binge on all my Twinkies
Throw up in the tub, then I go to sleep
And I drank up all my money,
dazed and kinda lonely
[Chorus]
You're gone and I gotta stay
High all the time to keep you off my mind
Ooh-ooh-ooh-ooh, ooh-ooh-ooh-ooh
High all the time to keep you off my mind
Ooh-ooh-ooh-ooh, ooh-ooh-ooh-ooh
Spend my days locked in a haze
Tryna forget you, babe, I fall back down
Gotta stay high all my life to forget I'm missin' you
Ooh-ooh-ooh-ooh, ooh-ooh-ooh-ooh
[Verse 2]
Pick up daddies at the playground, how I spend my day time
Loosen up their frown, make 'em feel alive
I make it fast and greasy, I'm numb and way too easy"
share_video_7331402048539217185_.mp3,What You Won't Do for Love,Bobby Caldwell,"[Verse 1]
I guess you wonder where I've been
I searched to find a love within
[Refrain]
I came back to let you know
Got a thing for you and I can't let go
[Verse 2]
My friends wonder what is wrong with me
Well, I'm in a daze from your love, you see
[Refrain]
I came back to let you know
Got a thing for you and I can't let it go
[Pre-Chorus]
Some people go around the world for love
But they may never find what they dream of
[Chorus]
What you won't do, do for love
You've tried everything, but you don't give up
In my world, only you
Make me do for love what I would not do"
