,artist,song_name,viral,lyrics,clean_lyrics
0,21 Savage,redrum,True,"Cai, a noite sobre o nosso amor
Cai, e agora só restou do amor
Uma palavra: Adeus
Woah, woah, woah


Want it all, I won't leave a breadcrumb
Bitch, what? I thought a nigga said somethin’
Thought a nigga said somethin'
G Block, all we know is redrum
Redrum, redrum, redrum, redrum
G Block, all we know is redrum
Redrum, redrum, redrum, redrum
Nigga, all we know is— (Redrum)


Ridin' in the back, it’s a May' (It's a May')
Thirty-two shots in the K (In the K)
Marathon, I really run the A (Run the A)
Say you touched me, how, Sway? (How, Sway?)
Graveyard, that's where the opps stay (Opps stay)
Hypnotize, they do what I say (What I say)
21, niggas don't play (Don't play)
My Glock Gen5 said hey (Said hey)
Take my choppеr everywherе, that's bae (That’s bae)
Get yo’ ass out the car, you givin' Tre (Givin’ Tre)
We been spinnin' through they hood all day (All day)
Niggas say they outside, okay, okay
I can't let a bitch play me, no way (No way)
You a duck if you believe what hoes say (What hoes say)
She got way more bodies than my old K (Old K)
My lil' brother beat his body, OJ (OJ)
Niggas talkin’ 'bout they lit, I'm La Flame (Pussy)
That lil' boy a mascot, he ain't gang (Pussy)
Watch a half a million dollars and it's plain (Pussy)
I don't go through TSA to get on planes (Pussy)
You get pussy without head, then you lame (Pussy)
She knew I was leavin' 'fore I even came (Pussy)
Two revolvers on my waist, John Wayne (Pussy)
Smack niggas, then I get on Live and sing (Yeah)
See 21 Savage LiveGet tickets as low as $22You might also like
Want it all, I won't leave a breadcrumb
Bitch, what? I thought a nigga said somethin'
Thought a nigga said somethin'
G Block, all we know is redrum
Redrum, redrum, redrum, redrum
G Block, all we know is redrum
Redrum, redrum, redrum, redrum
Nigga, all we know is— (Redrum)


How many niggas got the belt? (A lot)
Catch 'em at the light, he get nailed (Bow)
9-1-1, somebody help
Sub-tweeting bad for your health, pussy
I'm a gangster, I ain't takin' shit back, pussy
I'll never do no song with no rat, pussy
Put a Lego in a stick, it rat-a-tat, pussy
I don't wanna talk, go and catch a hat, pussy
Big Draco come up out that Scat, pussy
He stood on business, now he layin' on his back, pussy
Ask around, I be rappin' nothin' but facts, pussy
We the reason all these niggas runnin' track, pussy (On God)
You ain't never stepped, you can't tell me a thing (21)
I got big kahunas and I'm lettin' 'em hang (21)
Keep my mouth closed and that's never gon' change (21)
You get in the jam and go to pointin' and blame (21, 21)
I ain't let it slide, I was sharpenin' aim
Smokin' on my brothers, got his ass left slain
You know it's smoke, 'cause they ain't even take off his chain
Say it's up with me, your ass must do cocaine (21, 21)

Want it all, I won't leave a breadcrumb
Bitch, what? I thought a nigga said somethin'
Thought a nigga said somethin'
G Block, all we know is redrum
Redrum, redrum, redrum, redrum
G Block, all we know is redrum
Redrum, redrum, redrum, redrum
Nigga, all we know is— (Redrum)


Little pigs
Little pigs, let me come in
Not by the hair on your chinny-chin-chin?
Then I'll huff, and I'll puff, and I'll blow your house down
Here's Johnny",Cai a noite sobre o nosso amor Cai e agora só restou do amor Uma palavra Adeus Woah woah woah   Want it all I wont leave a breadcrumb Bitch what I thought a nigga said somethin’ Thought a nigga said somethin G Block all we know is redrum Redrum redrum redrum redrum G Block all we know is redrum Redrum redrum redrum redrum Nigga all we know is Redrum   Ridin in the back it’s a May Its a May Thirtytwo shots in the K In the K Marathon I really run the A Run the A Say you touched me how Sway How Sway Graveyard thats where the opps stay Opps stay Hypnotize they do what I say What I say 21 niggas dont play Dont play My Glock Gen5 said hey Said hey Take my choppеr everywherе thats bae That’s bae Get yo’ ass out the car you givin Tre Givin’ Tre We been spinnin through they hood all day All day Niggas say they outside okay okay I cant let a bitch play me no way No way You a duck if you believe what hoes say What hoes say She got way more bodies than my old K Old K My lil brother beat his body OJ OJ Niggas talkin’ bout they lit Im La Flame Pussy That lil boy a mascot he aint gang Pussy Watch a half a million dollars and its plain Pussy I dont go through TSA to get on planes Pussy You get pussy without head then you lame Pussy She knew I was leavin fore I even came Pussy Two revolvers on my waist John Wayne Pussy Smack niggas then I get on Live and sing Yeah See 21 Savage LiveGet tickets as low as 22You might also like Want it all I wont leave a breadcrumb Bitch what I thought a nigga said somethin Thought a nigga said somethin G Block all we know is redrum Redrum redrum redrum redrum G Block all we know is redrum Redrum redrum redrum redrum Nigga all we know is Redrum   How many niggas got the belt A lot Catch em at the light he get nailed Bow 911 somebody help Subtweeting bad for your health pussy Im a gangster I aint takin shit back pussy Ill never do no song with no rat pussy Put a Lego in a stick it ratatat pussy I dont wanna talk go and catch a hat pussy Big Draco come up out that Scat pussy He stood on business now he layin on his back pussy Ask around I be rappin nothin but facts pussy We the reason all these niggas runnin track pussy On God You aint never stepped you cant tell me a thing 21 I got big kahunas and Im lettin em hang 21 Keep my mouth closed and thats never gon change 21 You get in the jam and go to pointin and blame 21 21 I aint let it slide I was sharpenin aim Smokin on my brothers got his ass left slain You know its smoke cause they aint even take off his chain Say its up with me your ass must do cocaine 21 21  Want it all I wont leave a breadcrumb Bitch what I thought a nigga said somethin Thought a nigga said somethin G Block all we know is redrum Redrum redrum redrum redrum G Block all we know is redrum Redrum redrum redrum redrum Nigga all we know is Redrum   Little pigs Little pigs let me come in Not by the hair on your chinnychinchin Then Ill huff and Ill puff and Ill blow your house down Heres Johnny
1,21 Savage,née-nah,False,"I took a ballerina down to the ball dance
Met a couple ball players, found a ball stance
Now we in the bathroom, she found a ball face
Took some shots and balled out, now how the stall taste?
I can't even go inside, my old hoes might hear
I might need to hit the town, I need you right here, right here
'Til she reached in the trunk and found a nina
I told her, ""Baby, that's Nina Simone""
Ayy, drivin' through the liquor store faded, braided
Hands in this motherfucker wavin', hazy
'80s like the '90s and 2000s (Tuh-tuh-tuh-tuh-tuh-tuh-tuh)
Drivin' through this motherfucker, wildin'
Ayy, Brady seven pack, they come in bunch
I been with the 'quad on a high note, gettin' C-notes
Different presentation to this vibe, you need a keynote
Presi' 'round this motherfucker, I ain't sendin' vetos
Ain't no stoppin' shit or stoppin' licks, them boys on G-O
Battin' out the 504, I saved her name as ""Creole""
Balance when I'm on a road, I get the go and T-O
Dominatrix Matrix when she do it like I'm Neo
Shit is off its sockets, they lock in
Mama said live up to my name, but they jockin'
They gon' try go and take your face for the profit
They gon' lie, they gon' slip and slide, get beside ya
They gon' try, we a hundred deep like Verizon
In the trees with the bumble bees on horizon
Ain't catchin' Zs, I been in in the V, on road to Zion
Sell they souls, hoppin' in that mode that I ain't buyin'
You might also like
He ain't Slaughter Gang, then he ain't official (Yeah)
When that chopper sing, you really think that they gon' miss you?
I spent a half a million dollars on dismissals
It's gon' be a hearse, not a verse if I diss you (Mhm)
Got me fucked up, nigga, got me fucked up (Yeah)
When I send it past the ceilin', that shit stuck up
All that talkin', actin' tough get you roughed up (21, 21)
If your wifey at the spot, she gettin' bust up (21, 21)


Rich nigga, got my strap from Tommy Hilfiger (21)
Red, white, and blue, American, I kill niggas (Pussy)
Spray his block and then pull off, this a real dipple (Skrrt)
Bottega pick my cotton, but I'm a field nigga (On God)
I be sittin' inside the house 'cause I don't feel niggas (Fuck 'em)
Fuck with Baby, but my baby like to drill niggas (BabyDrill)
Claustrophobic, I don't even like to chill with 'em (21)
Guess I'm fake since everybody say they real niggas (On God)
Got a whoopin', but you still ain't learned your lesson, huh? (Pussy)
Hard-headed, you won't end up on a stretcher, huh? (Pussy)
Oh, you Usher now, you givin' out confessions, huh? (Pussy)
On the blogs like these hoes, oh, you messy, huh? (Pussy)
Put a Louis logo on my switch
I know Virgil probably lookin' down like, ""Damn, this nigga back on that shit"" (21)
Back inside the club with my blick (21)
Playin' freeze tag, shit, I'm tryna see who it (On God)
Niggas say we opps, when they see me, don't do shit (On God)
Only person believe that you a killer is your bitch (21)
Makin' diss songs, this nigga died about a diss (Facts)
If I see my opps while I'm in cuffs, then I'ma spit (Pussy)
Wanna kill the world about your bitch 'cause she on dick (21)
Thinkin' 'bout the hoes that I'ma shit on while I piss (21)
You ain't heard my music, why you ballin' up your fists? (21)
Reverb on the chopper, it go, ""Baow"" when it hit (21)

He ain't Slaughter Gang, then he ain't official (Yeah)
When that chopper sing, you really think that they gon' miss you?
I spent a half a million dollars on dismissals
It's gon' be a hearse, not a verse if I diss you (Mhm)
Got me fucked up, nigga, got me fucked up (Yeah)
When I send it past the ceilin', that shit stuck up
All that talkin', actin' tough get you roughed up (21, 21)
If your wifey at the spot, she gettin' bust up",I took a ballerina down to the ball dance Met a couple ball players found a ball stance Now we in the bathroom she found a ball face Took some shots and balled out now how the stall taste I cant even go inside my old hoes might hear I might need to hit the town I need you right here right here Til she reached in the trunk and found a nina I told her Baby thats Nina Simone Ayy drivin through the liquor store faded braided Hands in this motherfucker wavin hazy 80s like the 90s and 2000s Tuhtuhtuhtuhtuhtuhtuh Drivin through this motherfucker wildin Ayy Brady seven pack they come in bunch I been with the quad on a high note gettin Cnotes Different presentation to this vibe you need a keynote Presi round this motherfucker I aint sendin vetos Aint no stoppin shit or stoppin licks them boys on GO Battin out the 504 I saved her name as Creole Balance when Im on a road I get the go and TO Dominatrix Matrix when she do it like Im Neo Shit is off its sockets they lock in Mama said live up to my name but they jockin They gon try go and take your face for the profit They gon lie they gon slip and slide get beside ya They gon try we a hundred deep like Verizon In the trees with the bumble bees on horizon Aint catchin Zs I been in in the V on road to Zion Sell they souls hoppin in that mode that I aint buyin You might also like He aint Slaughter Gang then he aint official Yeah When that chopper sing you really think that they gon miss you I spent a half a million dollars on dismissals Its gon be a hearse not a verse if I diss you Mhm Got me fucked up nigga got me fucked up Yeah When I send it past the ceilin that shit stuck up All that talkin actin tough get you roughed up 21 21 If your wifey at the spot she gettin bust up 21 21   Rich nigga got my strap from Tommy Hilfiger 21 Red white and blue American I kill niggas Pussy Spray his block and then pull off this a real dipple Skrrt Bottega pick my cotton but Im a field nigga On God I be sittin inside the house cause I dont feel niggas Fuck em Fuck with Baby but my baby like to drill niggas BabyDrill Claustrophobic I dont even like to chill with em 21 Guess Im fake since everybody say they real niggas On God Got a whoopin but you still aint learned your lesson huh Pussy Hardheaded you wont end up on a stretcher huh Pussy Oh you Usher now you givin out confessions huh Pussy On the blogs like these hoes oh you messy huh Pussy Put a Louis logo on my switch I know Virgil probably lookin down like Damn this nigga back on that shit 21 Back inside the club with my blick 21 Playin freeze tag shit Im tryna see who it On God Niggas say we opps when they see me dont do shit On God Only person believe that you a killer is your bitch 21 Makin diss songs this nigga died about a diss Facts If I see my opps while Im in cuffs then Ima spit Pussy Wanna kill the world about your bitch cause she on dick 21 Thinkin bout the hoes that Ima shit on while I piss 21 You aint heard my music why you ballin up your fists 21 Reverb on the chopper it go Baow when it hit 21  He aint Slaughter Gang then he aint official Yeah When that chopper sing you really think that they gon miss you I spent a half a million dollars on dismissals Its gon be a hearse not a verse if I diss you Mhm Got me fucked up nigga got me fucked up Yeah When I send it past the ceilin that shit stuck up All that talkin actin tough get you roughed up 21 21 If your wifey at the spot she gettin bust up
2,21 Savage,ball w/o you,False,"Woah
Woah, woah


You runnin' 'round drinkin' liquor
Takin' pictures 'cause you miss me
(I know you miss me)
You runnin' 'round drinkin' liquor
Fuckin' niggas 'cause you miss me
(You just want attention)
You can sleep with half the world
Bet you still won't forget me
(On God)
You could find love, get married, have kids
I'd still be realest nigga to hit it
(Straight up, straight up, straight up, straight up)
I was gettin' some head earlier and you crossed my mind (Straight up)
I'm as solid as they come, but you crossed the line (21)
Yeah, you been stopped keepin' it real, I can see the signs (On God)
When it came to havin' your back, I'm so real
I prolly would've gave you my spine (Straight up)
I'd rather have loyalty than love
'Cause love really don't mean jack (Straight up)
See love is just a feeling
You can love somebody and still stab them in they back (On God)
It don't take much to love
You can love somebody just by being attached (21)
See loyalty is a action
You can love or hate me and still have my back (Facts)
See 21 Savage LiveGet tickets as low as $22You might also like
I gave you my all (My all)
You was my dawg (You was my dawg)
I would have went to war with the world on your call (On your call)
Thought you had my back (Nah)
You let me fall (Let me fall)
You healed my pain (My pain)
Then you caused it (Then you caused it)
Now I gotta ball without you (Straight up)
Now I gotta ball (Straight up)
Now I gotta ball without you (21)
Now I gotta ball (21)
Now I gotta ball without you (Ball)
Now I gotta ball (Now I gotta ball)
Now I gotta ball without you (21)
Now I gotta ball (21, 21)


You crossed me once, it's fuck you forever (Straight up)
Middle school got my heart broke, stop writin' love letters (21)
Heart cold, yeah, so cold had to buy the Moncler sweater (On God)
Valentines Day, she ripped the card and urinated on the rose petals (Damn)
You was my rock, heavy metal
Now you ain't shit to me (Facts)
I thought it was love, until I woke up
And had an epiphany (21)
Keep the fame and keep the love
Just give me the loyalty (On God)
Nefertiti, King Tut
I treat you like royalty (Fact)

I just wish your love wouldn't fade away
Even when the smoke clear, I'm here to stay
Don't you ever let a nigga take my place
Would you be around if I had minimum wage?


I gave you my all (My all)
You was my dawg (You was my dawg)
I would have went to war with the world on your call (On your call)
Thought you had my back (Nah)
You let me fall (Let me fall)
You healed my pain (My pain)
Then you caused it (Then you caused it)
Now I gotta ball without you (Straight up)
Now I gotta ball (Straight up)
Now I gotta ball without you (21)
Now I gotta ball (21)
Now I gotta ball without you (Ball)
Now I gotta ball (Now I gotta ball)
Now I gotta ball without you (21)
Now I gotta ball (21, 21)",Woah Woah woah   You runnin round drinkin liquor Takin pictures cause you miss me I know you miss me You runnin round drinkin liquor Fuckin niggas cause you miss me You just want attention You can sleep with half the world Bet you still wont forget me On God You could find love get married have kids Id still be realest nigga to hit it Straight up straight up straight up straight up I was gettin some head earlier and you crossed my mind Straight up Im as solid as they come but you crossed the line 21 Yeah you been stopped keepin it real I can see the signs On God When it came to havin your back Im so real I prolly wouldve gave you my spine Straight up Id rather have loyalty than love Cause love really dont mean jack Straight up See love is just a feeling You can love somebody and still stab them in they back On God It dont take much to love You can love somebody just by being attached 21 See loyalty is a action You can love or hate me and still have my back Facts See 21 Savage LiveGet tickets as low as 22You might also like I gave you my all My all You was my dawg You was my dawg I would have went to war with the world on your call On your call Thought you had my back Nah You let me fall Let me fall You healed my pain My pain Then you caused it Then you caused it Now I gotta ball without you Straight up Now I gotta ball Straight up Now I gotta ball without you 21 Now I gotta ball 21 Now I gotta ball without you Ball Now I gotta ball Now I gotta ball Now I gotta ball without you 21 Now I gotta ball 21 21   You crossed me once its fuck you forever Straight up Middle school got my heart broke stop writin love letters 21 Heart cold yeah so cold had to buy the Moncler sweater On God Valentines Day she ripped the card and urinated on the rose petals Damn You was my rock heavy metal Now you aint shit to me Facts I thought it was love until I woke up And had an epiphany 21 Keep the fame and keep the love Just give me the loyalty On God Nefertiti King Tut I treat you like royalty Fact  I just wish your love wouldnt fade away Even when the smoke clear Im here to stay Dont you ever let a nigga take my place Would you be around if I had minimum wage   I gave you my all My all You was my dawg You was my dawg I would have went to war with the world on your call On your call Thought you had my back Nah You let me fall Let me fall You healed my pain My pain Then you caused it Then you caused it Now I gotta ball without you Straight up Now I gotta ball Straight up Now I gotta ball without you 21 Now I gotta ball 21 Now I gotta ball without you Ball Now I gotta ball Now I gotta ball Now I gotta ball without you 21 Now I gotta ball 21 21
3,21 Savage,Rich Flex,False,"

Go buy a zip of weed, hit the club
Pay for 'bout ten niggas to get in
We crunk, lit, in this bitch, yeah
Know we walk around the world
Steppin', not givin a damn 'bout where our feet land at, yeah
Get your ass mushed, smooshed (6ix)
Yeah, 21, the biggest
Put a nigga in the chicken wing, pussy


21, can you do somethin' for me? (21)
Can you hit a lil' rich flex for me? (21)
And 21, can you do somethin' for me? (21, 21)
Drop some bars to my pussy ex for me
Then 21 (21), can you do somethin' for me? (Yeah)
Can you talk to the opps necks for me? (Okay)
21, do your thing 21, do your thing (21)
Do your thing, 21, do your thing


Yellow diamonds in the watch, this shit cost a lot
Never send a bitch your dot, that's how you get shot
I DM in Vanish Mode, I do that shit a lot
Took her panties off and this bitch thicker than the plot
All my exes ain't nothin', them hoes busted
If my opps ain't rappin', they ass duckin'
You ain't ready to pull the trigger, don't clutch it
I know you on your period baby, can you suck it?
I'm a savage (21)
Smack her booty in Magic (21, 21)
I'll slap a pussy nigga with a ratchet (Pussy)
I might slap a tracker on his whip and get the addy (Pussy)
Don't call me on Christmas Eve, bitch, call your daddy (21)
Bitch, call your uncle (21), bitch, don't call me (21)
Always in my ear, your ho a flea (Fuck)
Why my opps be posting guns and only use they feet? (21)
Paid like an athlete, I got—
You might also like
All you hoes, all of you hoes need to remember who y'all talkin' to
It's a Slaughter Gang CEO
I got dick for you if I'm not workin', girl
If I'm busy then fuck no
You need to find you someone else to call
When your bank account get low, you need to find you someone—




Ayy, ayy, ayy, ayy, ayy
I'm on that Slaughter Gang shit, ayy, murder gang shit
Ayy, Slaughter Gang shit, ayy, murder gang shit, ayy


Sticks and stones, chrome on chrome
That's just what a nigga on
Internet clones, got 'em kissin' through the phone
Pussies cliquin' up so they don't feel alone, ayy
Nan' nigga seein' me, I'm Young Money CMB
I used to roll with CMG, the house is not a BNB
The bad bitches waitin' on a nigga like I'm PND
I'm steady pushin' P, you niggas pushing PTSD
I told her ass to kiss me in the club, fuck a TMZ
I used to want a GMC, when Woe was doing B&E
We revvin' up and goin' on a run like we DMC
I layup with her for a couple days, then its BRB
You rappers love askin' if I fucked, when you know we did
When you know we did
She came in heels but she left out on her cozy shit
Ayy, I'm livin' every twenty-four like Kobe did
Shoutout to the 6ix, R.I.P to 8
Swear this shit is gettin' ate, I'm on ten for the cake
Get a lot of love from twelve, but I don't reciprocate
Fifty-one division stay patrollin' when it's late
21 my addy, so the knife is on the gate
All the dawgs eatin' off a Baccarat plate
Niggas see Drake and they underestimate
Take it from a vet', that's a rookie ass mistake, ayy

Ah, what, what
Slaughter Gang shit, ayy, murder gang shit
Ayy, Slaughter Gang shit, ayy, murder gang shit
Ayy, Slaughter Gang shit, ayy, murder gang shit
On God
Boy, look, you the motherfuckin' man, boy, you, ooh
You is the man, you hear me?",  Go buy a zip of weed hit the club Pay for bout ten niggas to get in We crunk lit in this bitch yeah Know we walk around the world Steppin not givin a damn bout where our feet land at yeah Get your ass mushed smooshed 6ix Yeah 21 the biggest Put a nigga in the chicken wing pussy   21 can you do somethin for me 21 Can you hit a lil rich flex for me 21 And 21 can you do somethin for me 21 21 Drop some bars to my pussy ex for me Then 21 21 can you do somethin for me Yeah Can you talk to the opps necks for me Okay 21 do your thing 21 do your thing 21 Do your thing 21 do your thing   Yellow diamonds in the watch this shit cost a lot Never send a bitch your dot thats how you get shot I DM in Vanish Mode I do that shit a lot Took her panties off and this bitch thicker than the plot All my exes aint nothin them hoes busted If my opps aint rappin they ass duckin You aint ready to pull the trigger dont clutch it I know you on your period baby can you suck it Im a savage 21 Smack her booty in Magic 21 21 Ill slap a pussy nigga with a ratchet Pussy I might slap a tracker on his whip and get the addy Pussy Dont call me on Christmas Eve bitch call your daddy 21 Bitch call your uncle 21 bitch dont call me 21 Always in my ear your ho a flea Fuck Why my opps be posting guns and only use they feet 21 Paid like an athlete I got You might also like All you hoes all of you hoes need to remember who yall talkin to Its a Slaughter Gang CEO I got dick for you if Im not workin girl If Im busy then fuck no You need to find you someone else to call When your bank account get low you need to find you someone     Ayy ayy ayy ayy ayy Im on that Slaughter Gang shit ayy murder gang shit Ayy Slaughter Gang shit ayy murder gang shit ayy   Sticks and stones chrome on chrome Thats just what a nigga on Internet clones got em kissin through the phone Pussies cliquin up so they dont feel alone ayy Nan nigga seein me Im Young Money CMB I used to roll with CMG the house is not a BNB The bad bitches waitin on a nigga like Im PND Im steady pushin P you niggas pushing PTSD I told her ass to kiss me in the club fuck a TMZ I used to want a GMC when Woe was doing BE We revvin up and goin on a run like we DMC I layup with her for a couple days then its BRB You rappers love askin if I fucked when you know we did When you know we did She came in heels but she left out on her cozy shit Ayy Im livin every twentyfour like Kobe did Shoutout to the 6ix RIP to 8 Swear this shit is gettin ate Im on ten for the cake Get a lot of love from twelve but I dont reciprocate Fiftyone division stay patrollin when its late 21 my addy so the knife is on the gate All the dawgs eatin off a Baccarat plate Niggas see Drake and they underestimate Take it from a vet thats a rookie ass mistake ayy  Ah what what Slaughter Gang shit ayy murder gang shit Ayy Slaughter Gang shit ayy murder gang shit Ayy Slaughter Gang shit ayy murder gang shit On God Boy look you the motherfuckin man boy you ooh You is the man you hear me
