,artist,song_name,viral,lyrics,clean_lyrics
26,Flo Milli,Conceited,False,"(That's Fyre)


Feelin' myself, I'm conceited (Huh)
Feelin' myself, I'm conceited (Yeah)
Feelin' myself, I'm conceited (Huh)
Feelin' myself, I'm conceited (Wow)
Feelin' myself, I'm conceited (Huh)
Feelin' myself, I'm conceited (Yeah)
Feelin' myself, I'm conceited (Huh)
Feelin' myself, I'm conceited (Flo Milli shit)


You never dated a chocolate bitch (Pretty)
You want a model bitch off of the internet (Internet)
All that ki-ki-ki'n', I ain't into that
All my mini-me's, I invented that, facts
Long-ass weave flow down my back (Forty inch)
I want a pitcher wit' a baseball bat (Swing)
Hoes don't like when I talk like that
Please don't bark 'cause Milli bite back
I huff then I puff then I blow shit down (Ooh)
Stand-up bitch, ho, go sit down (Damn)
Put your ear on this coochie, hear this ocean sound (Uh)
(I fuck once) Boy, you old dick now
You got money 'cause you on dicks
Milli got milli's 'cause Milli got hits (I got hits)
You pop pimples, ho, I pop shit
You can talk like this when you really that bitch (Uh, yeah)
You might also like
Feelin' myself, I'm conceited (Huh)
Feelin' myself, I'm conceited (Yeah)
Feelin' myself, I'm conceited (Huh)
Feelin' myself, I'm conceited (Wow)
Feelin' myself, I'm conceited (Huh)
Feelin' myself, I'm conceited (Yeah)
Feelin' myself, I'm conceited (Huh)
Feelin' myself, I'm conceited (Huh)


Straight outta Mobile, Louis on both heels
Fuck how a ho feel, girl, just relax
Smack a lil' bitch, ho, you a gnat (You a gnat, bitch)
Bitch get jealous when I do it like that
Celine on my eyes like a diva (Hey)
I been that bitch since a fetus (I been that bitch)
Been had my stripes, no Adidas (Duh)
My opps takin' pics when they see us
I'm so fabulous (I am)
Bitch, I'm fabulous (Hey)
I don't need his money (Nope)
Bitch, I got enough (Flo Milli shit)
Pretty bitch walk in, they gon' salute (Uh)
I don't wanna talk, bitch, just keep it cute (Duh)
Big yellow coupe, no top on the roof (Skrrt, skrrt)
Brush my hair when I walk in the booth (Hey)

Feelin' myself, I'm conceited (Huh)
Feelin' myself, I'm conceited (Yeah)
Feelin' myself, I'm conceited (Huh)
Feelin' myself, I'm conceited (Wow)
Feelin' myself, I'm conceited (Huh)
Feelin' myself, I'm conceited (Yeah)
Feelin' myself, I'm conceited (Huh)
Feelin' myself, I'm conceited (Huh)",Thats Fyre   Feelin myself Im conceited Huh Feelin myself Im conceited Yeah Feelin myself Im conceited Huh Feelin myself Im conceited Wow Feelin myself Im conceited Huh Feelin myself Im conceited Yeah Feelin myself Im conceited Huh Feelin myself Im conceited Flo Milli shit   You never dated a chocolate bitch Pretty You want a model bitch off of the internet Internet All that kikikin I aint into that All my minimes I invented that facts Longass weave flow down my back Forty inch I want a pitcher wit a baseball bat Swing Hoes dont like when I talk like that Please dont bark cause Milli bite back I huff then I puff then I blow shit down Ooh Standup bitch ho go sit down Damn Put your ear on this coochie hear this ocean sound Uh I fuck once Boy you old dick now You got money cause you on dicks Milli got millis cause Milli got hits I got hits You pop pimples ho I pop shit You can talk like this when you really that bitch Uh yeah You might also like Feelin myself Im conceited Huh Feelin myself Im conceited Yeah Feelin myself Im conceited Huh Feelin myself Im conceited Wow Feelin myself Im conceited Huh Feelin myself Im conceited Yeah Feelin myself Im conceited Huh Feelin myself Im conceited Huh   Straight outta Mobile Louis on both heels Fuck how a ho feel girl just relax Smack a lil bitch ho you a gnat You a gnat bitch Bitch get jealous when I do it like that Celine on my eyes like a diva Hey I been that bitch since a fetus I been that bitch Been had my stripes no Adidas Duh My opps takin pics when they see us Im so fabulous I am Bitch Im fabulous Hey I dont need his money Nope Bitch I got enough Flo Milli shit Pretty bitch walk in they gon salute Uh I dont wanna talk bitch just keep it cute Duh Big yellow coupe no top on the roof Skrrt skrrt Brush my hair when I walk in the booth Hey  Feelin myself Im conceited Huh Feelin myself Im conceited Yeah Feelin myself Im conceited Huh Feelin myself Im conceited Wow Feelin myself Im conceited Huh Feelin myself Im conceited Yeah Feelin myself Im conceited Huh Feelin myself Im conceited Huh
27,Flo Milli,Never Lose Me,True,"Never had a bitch like me in your life
You ain't never had a bitch like me in your life, uh
Never had a bitch like me in your life
You ain't never had a bitch like me in your life (Yeah)


He speed in the Wraith while his hand on my coochie (Yeah)
He touchin' Emilio Pucci (Uh)
Doin' good, bitch, I'm gucci (I'm good)
Fly to Asia, he feedin' me sushi (Ooh)
When we fuckin', it feel like a movie
Raw bitch, ain't never been a groupie
Stiff on a ho, I like my nigga bougie (Yeah)
Tell me you don't nevеr wanna lose me


Tell mе you don't never wanna lose me
Tell me you don't never wanna lose me
Tell me you don't never wanna lose me
Tell me you don't never wanna lose me
Tell me you don't never wanna lose me
Tell me you don't never wanna lose me (Lose me)
Tell me you don't never—


Keep me a Haitian, I love me a Zoe
I've been thinkin' 'bout you on the road
We havin' rich sex on a boat
He hit it back to back like it's dope (Like it's dope)
How you gon' prove you could treat me right?
You stole my heart like a thief in the night
Yeah, he my man, he was never your type
If you try me, ho, it's on sight
He totin' the Uzi, but he actin' real bougie (Bougie, yeah)
I like to fight over dick, ho, don't get hit with the two-piece (Two-piece)
You know you can call if you need me
Tell me you ain't never ever leavin' (No)
When I suck it, I look in your eyes (Yeah)
You better fuck me like you mean it (Fuck me like you mean it)
You might also like
Tell me you don't never wanna lose me
Tell me you don't never wanna lose me
Tell me you don't never wanna lose me
Tell me you don't never wanna lose me
Tell me you don't never wanna lose me
Tell me you don't never wanna lose me (Lose me)
Tell me you don't never—


He speed in the Wraith while his hand on my coochie
Doin' good, bitch, I'm gucci
When we fuckin', it feel like a movie
Be stiff on a ho, I like my nigga bougie (Yeah)
Tell me you don't never wanna lose meEmbed",Never had a bitch like me in your life You aint never had a bitch like me in your life uh Never had a bitch like me in your life You aint never had a bitch like me in your life Yeah   He speed in the Wraith while his hand on my coochie Yeah He touchin Emilio Pucci Uh Doin good bitch Im gucci Im good Fly to Asia he feedin me sushi Ooh When we fuckin it feel like a movie Raw bitch aint never been a groupie Stiff on a ho I like my nigga bougie Yeah Tell me you dont nevеr wanna lose me   Tell mе you dont never wanna lose me Tell me you dont never wanna lose me Tell me you dont never wanna lose me Tell me you dont never wanna lose me Tell me you dont never wanna lose me Tell me you dont never wanna lose me Lose me Tell me you dont never   Keep me a Haitian I love me a Zoe Ive been thinkin bout you on the road We havin rich sex on a boat He hit it back to back like its dope Like its dope How you gon prove you could treat me right You stole my heart like a thief in the night Yeah he my man he was never your type If you try me ho its on sight He totin the Uzi but he actin real bougie Bougie yeah I like to fight over dick ho dont get hit with the twopiece Twopiece You know you can call if you need me Tell me you aint never ever leavin No When I suck it I look in your eyes Yeah You better fuck me like you mean it Fuck me like you mean it You might also like Tell me you dont never wanna lose me Tell me you dont never wanna lose me Tell me you dont never wanna lose me Tell me you dont never wanna lose me Tell me you dont never wanna lose me Tell me you dont never wanna lose me Lose me Tell me you dont never   He speed in the Wraith while his hand on my coochie Doin good bitch Im gucci When we fuckin it feel like a movie Be stiff on a ho I like my nigga bougie Yeah Tell me you dont never wanna lose meEmbed
28,Kanye West,BURN,False,"Her body like the wild, wild west
What if you don't bow down? Yeah
Ridin' in the wind, God bless
She's an inferno, it's a hell of a time


Burnin' like a candlelight
Your love is dangerous
Your love is, my love is
Our love is
Burnin' like a candlelight (Are you not entertained?)
Your love is dangerous
Your love is, my love is (Are you not entertained?)
Our love is


Who's not entertained by my pain?
Who ain't cash a check off my name?
When my campaign turned to cam-pain
I burned eight billion to takе off my chains
Burn, baby, burn
Sometimes it hurts, I guess I nеver learned
To who it may concern, the CEO of the firm
Is now somewhere smoking sherm with Big Worm
Man, a couple wrong turns
Could fry you forever, it's a permanent burn
You charging for cookie, that's bang for your buck
If you kissin' on the mouth, you ain't charging enough
You heard I was flyin' 'em out
They was tryin' for clout, I was dyin' of gout
Man, the world gone mad
Heard R. Kelly in the next Balenciaga ad
You might also like
Burnin' like a candlelight (Burn)
Your love is dangerous
Your love is, my love is
Our love is
Burnin' like a candlelight
Your love is dangerous
Your love is, my love is
Our love is


Her body like the wild, wild west
What if you don't bow down? Yeah
Ridin' in the wind, God bless
She's an inferno, it's a hell of a time",Her body like the wild wild west What if you dont bow down Yeah Ridin in the wind God bless Shes an inferno its a hell of a time   Burnin like a candlelight Your love is dangerous Your love is my love is Our love is Burnin like a candlelight Are you not entertained Your love is dangerous Your love is my love is Are you not entertained Our love is   Whos not entertained by my pain Who aint cash a check off my name When my campaign turned to campain I burned eight billion to takе off my chains Burn baby burn Sometimes it hurts I guess I nеver learned To who it may concern the CEO of the firm Is now somewhere smoking sherm with Big Worm Man a couple wrong turns Could fry you forever its a permanent burn You charging for cookie thats bang for your buck If you kissin on the mouth you aint charging enough You heard I was flyin em out They was tryin for clout I was dyin of gout Man the world gone mad Heard R Kelly in the next Balenciaga ad You might also like Burnin like a candlelight Burn Your love is dangerous Your love is my love is Our love is Burnin like a candlelight Your love is dangerous Your love is my love is Our love is   Her body like the wild wild west What if you dont bow down Yeah Ridin in the wind God bless Shes an inferno its a hell of a time
29,Kanye West,CARNIVAL,True,"Go, go, go, go
Head so good, she a honor roll
She ride the dick like a carnival
I done did the impossible
Go, go, go, go
Head so good, she a honor roll
She ride the dick like a carnival
I done did the impossible
Go
Ha, ha, ha, schyeah


Way too rich to drive a Rove'
Made a milli' off the stove
She like to put it in her nose
Pretty bitch with white toes
I done put on all the bros
I done fucked her in the Rolls (Hahahaha)
I done pulled up in the Ghost
I done reachеd all my goals
Yeah, yeah, pull up with Yeezy and Dolla $ign
I'm all about business, I'm mindin' minе
Pull up in the trenches like Columbine
Pull up with the rocket like NumbaNine
I don't want your hoes
Young nigga reach all the goals
Let her suck the dick, said she was a pro
If she scrape her teeth, I'ma tell her to go
You might also like
Go, go, go, go
Head so good, she a honor roll
She'll ride the dick like carnival
I done did the impossible
Go, go, go, go (Ha, ha)
Head so good, she a honor roll
She'll ride the dick like carnival
I done did the impossible (Dolla $ign)


She ride it like Six Flags
We turn up to the max
I whop her from the back
I gave that bitch a cramp
They love me out in France
In the hood, I'm good, I'm stamped
Every day, I dress all black
For a show, nine hundred racks
Middle East call, double that
On my neck a bubble bath
On my wrist, new Cadillac
Cut her off, don't want her back
Little bitch, I'm a superstar
These hoes wanna fuck my car
My dog put a nigga in park
Gotta watch out for the narcs, ayy

This that Game of Thrones, Yeezy, not the clones
Elon, where my rocket ship? It's time to go home
They served us the porn since the day we was born
Anybody pissed off, gotta make 'em drink the urine
Now I'm Ye-Kelly, bitch, now I'm Bill Cosby, bitch
Now, I'm Puff Daddy rich, that's Me Too me rich
Why she say she sucked my dick? Then she say she ain't sucked my dick?
She gon' take it up the ass like a ventriloquist
I mean since Taylor Swift, since I had the Rollie on the wrist
I'm the new Jesus, bitch, I turn water to Cris'
This for what they did to Chris, they can't do shit with this
Got my kids in a fake school, we ain't—

Go, go, go, go
Head so good, she a honor roll
She'll ride the dick like carnival (Schyeah)
I done did the impossible (Schyeah)
Go, go, go, go
Head so good, she a honor roll
She'll ride the dick like carnival
I done did the impossible


She ride the dick like a carnival
Bend her over, havin' flashbacks, she gon' eat me up like a carnivore
It's the way I pop my shit, the hoes not ready, I'm goin' barnacles
Movin', I feel like I'm Jason, can't get arrested, I make 'em stumble
She want a private section, roll off them X's when I'm on Melrose
She tatted my name on her titties, yeah, you can bust it, but it's a borrow
Hol' up, sittin' back, countin' up dubs, I was raised in the borough
She wanna taste it, checkin' the swag today, ho, come back tomorrow
If you know what I know, hide your ho
Just off the facts that we havin' them hunchos
Runnin' around in the lobby, I know that they tired of me havin' like ten hoes
She need some cresidentials just to be presidential, hol' up, hol' up
I'm 'bout to buy her some dentures, make that ho eat me for dinner, woah, woah
Pain all in my eyes, I can't see, uh
I'm 'bout to jump out my body, I'm ready to leap, uh
I'm 'bout to nut on her body and tell the ho leave, 'kay
Fifty mil' stuffed in the bag, tell the whole gang eat, uh
It's Ye and Barti, tell me who fuckin' with we?
I'm hot like Tha Carter, I'm feelin' that ho in my sleep
Dollar signs all in my dreams, I don't never see Z's, woah (Woah-woah)
The swag cover my body like it's a disease, woah (Woah-woah)

Woah, woah, woah
Woah, woah, woah


Go, go, go, go
Head so good, she a honor roll
She ride the dick like a carnival
I done did the impossible
Go, go, go, go
Head so good, she a honor roll
She ride the dick like a carnival
I done did the impossible


Go, go, go, go
Go, go, go, go
Go, go, go, go
Go, go, go, go",Go go go go Head so good she a honor roll She ride the dick like a carnival I done did the impossible Go go go go Head so good she a honor roll She ride the dick like a carnival I done did the impossible Go Ha ha ha schyeah   Way too rich to drive a Rove Made a milli off the stove She like to put it in her nose Pretty bitch with white toes I done put on all the bros I done fucked her in the Rolls Hahahaha I done pulled up in the Ghost I done reachеd all my goals Yeah yeah pull up with Yeezy and Dolla ign Im all about business Im mindin minе Pull up in the trenches like Columbine Pull up with the rocket like NumbaNine I dont want your hoes Young nigga reach all the goals Let her suck the dick said she was a pro If she scrape her teeth Ima tell her to go You might also like Go go go go Head so good she a honor roll Shell ride the dick like carnival I done did the impossible Go go go go Ha ha Head so good she a honor roll Shell ride the dick like carnival I done did the impossible Dolla ign   She ride it like Six Flags We turn up to the max I whop her from the back I gave that bitch a cramp They love me out in France In the hood Im good Im stamped Every day I dress all black For a show nine hundred racks Middle East call double that On my neck a bubble bath On my wrist new Cadillac Cut her off dont want her back Little bitch Im a superstar These hoes wanna fuck my car My dog put a nigga in park Gotta watch out for the narcs ayy  This that Game of Thrones Yeezy not the clones Elon where my rocket ship Its time to go home They served us the porn since the day we was born Anybody pissed off gotta make em drink the urine Now Im YeKelly bitch now Im Bill Cosby bitch Now Im Puff Daddy rich thats Me Too me rich Why she say she sucked my dick Then she say she aint sucked my dick She gon take it up the ass like a ventriloquist I mean since Taylor Swift since I had the Rollie on the wrist Im the new Jesus bitch I turn water to Cris This for what they did to Chris they cant do shit with this Got my kids in a fake school we aint  Go go go go Head so good she a honor roll Shell ride the dick like carnival Schyeah I done did the impossible Schyeah Go go go go Head so good she a honor roll Shell ride the dick like carnival I done did the impossible   She ride the dick like a carnival Bend her over havin flashbacks she gon eat me up like a carnivore Its the way I pop my shit the hoes not ready Im goin barnacles Movin I feel like Im Jason cant get arrested I make em stumble She want a private section roll off them Xs when Im on Melrose She tatted my name on her titties yeah you can bust it but its a borrow Hol up sittin back countin up dubs I was raised in the borough She wanna taste it checkin the swag today ho come back tomorrow If you know what I know hide your ho Just off the facts that we havin them hunchos Runnin around in the lobby I know that they tired of me havin like ten hoes She need some cresidentials just to be presidential hol up hol up Im bout to buy her some dentures make that ho eat me for dinner woah woah Pain all in my eyes I cant see uh Im bout to jump out my body Im ready to leap uh Im bout to nut on her body and tell the ho leave kay Fifty mil stuffed in the bag tell the whole gang eat uh Its Ye and Barti tell me who fuckin with we Im hot like Tha Carter Im feelin that ho in my sleep Dollar signs all in my dreams I dont never see Zs woah Woahwoah The swag cover my body like its a disease woah Woahwoah  Woah woah woah Woah woah woah   Go go go go Head so good she a honor roll She ride the dick like a carnival I done did the impossible Go go go go Head so good she a honor roll She ride the dick like a carnival I done did the impossible   Go go go go Go go go go Go go go go Go go go go
30,Kanye West,Heartless,False,"In the night, I hear 'em talk
The coldest story ever told
Somewhere far along this road
He lost his soul to a woman so heartless
How could you be so heartless?
Oh, how could you be so heartless?


How could you be so
Cold as the winter wind when it breeze, yo?
Just remember that you talkin' to me though
You need to watch the way you talkin' to me, yo
I mean, after all the things that we been through
I mean, after all the things we got into
Ayo, I know of some things that you ain't told me
Ayo, I did some things but that's the old me
And now you wanna get me back and you gon' show me
So you walk around like you don't know me
You got a new friend, well, I got homies
But in the end, it's still so lonely


In the night, I hear 'em talk
The coldest story ever told
Somewhere far along this road
He lost his soul to a woman so heartless
How could you be so heartless?
Oh, how could you be so heartless?
You might also like
How could you be so Dr. Evil?
You're bringin' out a side of me that I don't know
I decided we wasn't gon' speak so
Why we up 3 AM on the phone?
Why do she be so mad at me fo'?
Homie, I don't know, she's hot and cold
I won't stop, won't mess my groove up
‘Cause I already know how this thing go
You run and tell your friends that you're leavin' me
They say that they don't see what you see in me
You wait a couple of months, then you gon' see
You'll never find nobody better than me


In the night, I hear 'em talk (Me)
The coldest story ever told
Somewhere far along this road
He lost his soul to a woman so heartless
How could you be so heartless?
Oh, how could you be so heartless?


Talk and talk and talk and talk
Baby, let's just knock it off
They don't know what we been through
They don't know 'bout me and you
So I got somethin' new to see
And you just gon' keep hatin' me
And we just gon' be enemies
I know you can't believe
I could just leave it wrong
And you can't make it right
I'm gon' take off tonight into the night

In the night, I hear 'em talk
The coldest story ever told
Somewhere far along this road
He lost his soul to a woman so heartless
How could you be so heartless? (How, how?)
Oh, how could you be so heartless?


On and on and on and on
And on and, and on and on and on",In the night I hear em talk The coldest story ever told Somewhere far along this road He lost his soul to a woman so heartless How could you be so heartless Oh how could you be so heartless   How could you be so Cold as the winter wind when it breeze yo Just remember that you talkin to me though You need to watch the way you talkin to me yo I mean after all the things that we been through I mean after all the things we got into Ayo I know of some things that you aint told me Ayo I did some things but thats the old me And now you wanna get me back and you gon show me So you walk around like you dont know me You got a new friend well I got homies But in the end its still so lonely   In the night I hear em talk The coldest story ever told Somewhere far along this road He lost his soul to a woman so heartless How could you be so heartless Oh how could you be so heartless You might also like How could you be so Dr Evil Youre bringin out a side of me that I dont know I decided we wasnt gon speak so Why we up 3 AM on the phone Why do she be so mad at me fo Homie I dont know shes hot and cold I wont stop wont mess my groove up ‘Cause I already know how this thing go You run and tell your friends that youre leavin me They say that they dont see what you see in me You wait a couple of months then you gon see Youll never find nobody better than me   In the night I hear em talk Me The coldest story ever told Somewhere far along this road He lost his soul to a woman so heartless How could you be so heartless Oh how could you be so heartless   Talk and talk and talk and talk Baby lets just knock it off They dont know what we been through They dont know bout me and you So I got somethin new to see And you just gon keep hatin me And we just gon be enemies I know you cant believe I could just leave it wrong And you cant make it right Im gon take off tonight into the night  In the night I hear em talk The coldest story ever told Somewhere far along this road He lost his soul to a woman so heartless How could you be so heartless How how Oh how could you be so heartless   On and on and on and on And on and and on and on and on
