,artist,song_name,viral,lyrics,clean_lyrics
75,The Weeknd,Save Your Tears,False,"Ooh
Na-na, yeah


I saw you dancing in a crowded room (Uh)
You look so happy when I'm not with you
But then you saw me, caught you by surprise
A single teardrop falling from your eye


I don't know why I run away
I make you cry when I run away


You could've asked me why I broke your heart
You could've told me that you fell apart
But you walked past me like I wasn't there
And just pretended like you didn't care


I don't know why I run away
I make you cry when I run away


Take me back 'cause I wanna stay
Save your tears for another
You might also like
Save your tears for another day
Save your tears for another day (So)


I made you think that I would always stay
I said some things that I should never say
Yeah, I broke your heart like someone did to mine
And now you won't love me for a second time


I don't know why I run away, oh, girl
Said, I make you cry when I run away


Girl, take me back 'cause I wanna stay
Save your tears for another
I realize that I'm much too late
And you deserve someone better


Save your tears for another day (Oh yeah)
Save your tears for another day (Yeah)


I don't know why I run away
I'll make you cry when I run away

Save your tears for another day
Ooh, girl, I said (Ah)
Save your tears for another day (Ah)


Save your tears for another day (Ah)
Save your tears for another day (Ah)",Ooh Nana yeah   I saw you dancing in a crowded room Uh You look so happy when Im not with you But then you saw me caught you by surprise A single teardrop falling from your eye   I dont know why I run away I make you cry when I run away   You couldve asked me why I broke your heart You couldve told me that you fell apart But you walked past me like I wasnt there And just pretended like you didnt care   I dont know why I run away I make you cry when I run away   Take me back cause I wanna stay Save your tears for another You might also like Save your tears for another day Save your tears for another day So   I made you think that I would always stay I said some things that I should never say Yeah I broke your heart like someone did to mine And now you wont love me for a second time   I dont know why I run away oh girl Said I make you cry when I run away   Girl take me back cause I wanna stay Save your tears for another I realize that Im much too late And you deserve someone better   Save your tears for another day Oh yeah Save your tears for another day Yeah   I dont know why I run away Ill make you cry when I run away  Save your tears for another day Ooh girl I said Ah Save your tears for another day Ah   Save your tears for another day Ah Save your tears for another day Ah
76,The Weeknd,The Hills,False,"Yeah
Yeah
Yeah


Your man on the road, he doin' promo
You said, ""Keep our business on the low-low""
I'm just tryna get you out the friend zone
'Cause you look even better than the photos
I can't find your house, send me the info
Drivin' through the gated residential
Found out I was comin', sent your friends home
Keep on tryna hide it, but your friends know


I only call you when it's half-past five
The only time that I'll be by your side
I only love it when you touch me, not feel me
When I'm fucked up, that's the real me
When I'm fucked up, that's the real me, yeah
I only call you when it's half-past five
The only time I'd ever call you mine
I only love it when you touch me, not feel me
When I'm fucked up, that's the real me
When I'm fucked up, that's the real me, babe
You might also like
I'ma let you know and keep it simple
Tryna keep it up don't seem so simple
I just fucked two bitches 'fore I saw you
And you gon' have to do it at my tempo
Always tryna send me off to rehab
Drugs started feelin' like it's decaf
I'm just tryna live life for the moment
And all these motherfuckers want a relapse


I only call you when it's half-past five
The only time that I'll be by your side
I only love it when you touch me, not feel me
When I'm fucked up, that's the real me
When I'm fucked up, that's the real me, yeah
I only call you when it's half-past five
The only time I'd ever call you mine
I only love it when you touch me, not feel me
When I'm fucked up, that's the real me
When I'm fucked up, that's the real me, babe


Hills have eyes, the hills have eyes
Who are you to judge? Who are you to judge?
Hide your lies, girl, hide your lies (Hide your lies, oh, baby)
Only you to trust, only you

I only call you when it's half-past five
The only time that I'll be by your side
I only love it when you touch me, not feel me
When I'm fucked up, that's the real me
When I'm fucked up, that's the real me, yeah
I only call you when it's half-past five
The only time I'd ever call you mine
I only love it when you touch me, not feel me
When I'm fucked up, that's the real me
When I'm fucked up, that's the real me, babe


Ewedihalehu
Yene konjo, ewedihalehu
Yene fikir, fikir, fikir, fikir
Yene fikir, fikir, fikir, fikir
Ewedihalehu
Yene konjo, ewedihalehu...1.8KEmbed",Yeah Yeah Yeah   Your man on the road he doin promo You said Keep our business on the lowlow Im just tryna get you out the friend zone Cause you look even better than the photos I cant find your house send me the info Drivin through the gated residential Found out I was comin sent your friends home Keep on tryna hide it but your friends know   I only call you when its halfpast five The only time that Ill be by your side I only love it when you touch me not feel me When Im fucked up thats the real me When Im fucked up thats the real me yeah I only call you when its halfpast five The only time Id ever call you mine I only love it when you touch me not feel me When Im fucked up thats the real me When Im fucked up thats the real me babe You might also like Ima let you know and keep it simple Tryna keep it up dont seem so simple I just fucked two bitches fore I saw you And you gon have to do it at my tempo Always tryna send me off to rehab Drugs started feelin like its decaf Im just tryna live life for the moment And all these motherfuckers want a relapse   I only call you when its halfpast five The only time that Ill be by your side I only love it when you touch me not feel me When Im fucked up thats the real me When Im fucked up thats the real me yeah I only call you when its halfpast five The only time Id ever call you mine I only love it when you touch me not feel me When Im fucked up thats the real me When Im fucked up thats the real me babe   Hills have eyes the hills have eyes Who are you to judge Who are you to judge Hide your lies girl hide your lies Hide your lies oh baby Only you to trust only you  I only call you when its halfpast five The only time that Ill be by your side I only love it when you touch me not feel me When Im fucked up thats the real me When Im fucked up thats the real me yeah I only call you when its halfpast five The only time Id ever call you mine I only love it when you touch me not feel me When Im fucked up thats the real me When Im fucked up thats the real me babe   Ewedihalehu Yene konjo ewedihalehu Yene fikir fikir fikir fikir Yene fikir fikir fikir fikir Ewedihalehu Yene konjo ewedihalehu18KEmbed
77,Ty Dolla $ign,DO IT,False,"Do it stay waxed?
Do it smell fresh?
Can I feel your juice through the latex?
If you go 'round, do you stay wet?
Can your homegirl watch? Can she go next?
Need the lights on, tell her watch this
When I make you cream, I'ma talk shit (I just wanna know)
And you fuck back, and you got grip
Stick your tongue out when you get your spot hit
I just wanna know


All this money on the floor
Ten racks, throw it up
Watch how I do it, make her drop to her toes
Bend it over, pick it up real slow
I do it, baby, do it
Up that work, ice like a jacuzzi
In my bag, call me '06 Gucci
What's happenin'? Tryna make a movie?


Just touched down, feelin' like Lucci
Fuckin' on Tisha, fuckin' on Suzi
Don't discriminate with this Uzi
She just wanna drink, do a lil' tuci
Beat it all day, beat it all night
I be on gorilla, goin' Kimbo Slicе
I be with the killers, need to pay your finеs
Try me once, you gon' pay with your life
All these dimes on me
What's your set? Bitch, throw it up
Heard you got a man, but he ain't like us
Your bitty bands ain't doin' enough
Know it's all on me
This might make you fall in love
Tellin' your friends you found the one
And I'm like ""Who?"" and I'm like ""What?""
You might also like
All this money on the floor
Ten racks, throw it up
Watch how I do it, make her drop to her toes
Bend it over, pick it up real slow
I do it, baby, do it
Up that work, ice like a jacuzzi
In my bag, call me '06 Gucci
What's happenin'? Tryna make a movie?


You don't like it? That's your loss
Your opinion don't change the show cost
Let me know what these hoes cost
I ain't finna pay the whole cost
Throwin' so much money, you gon' need an audit
God in me, so anything you want, I got it
Southside, Do or Die, Chi-Town top five
Four, three, two, one, who am I?
Ye, that's Ye-Ye
Text a ho a hunnid K, Apple payday
If I show up where she work, I think she just might quit
I just bought my bitch a bitch, uh
Spendin' all this money like it's free to me
That shit fall off trees to me
We ain't even stress, we the new kings and sheikhs
We done made a mess they gon' have to clean for weeks

All this money on the floor (Yee)
Ten racks, throw it up
Watch how I do it, make her drop to her toes
Bend it over, pick it up real slow
I do it, baby, do it
Up that work, ice like a jacuzzi
In my bag, call me '06 Gucci
What's happenin'? Tryna make a movie?


Do it, do it
She got the lil' fat, she finna lose it (She finna lose)
Fuck her from the back, goin' stupid (Goin' stupid)
Pullin' out the tracks, she gotta glue it (She gotta glue it)
Eeny, meeny, miny, moe, she choosy (She what?)
Fuck her like I love her, I'm confusin' (I would)
She don't wanna go home, she refusin'
Hit it up the cherry bomb, that pussy poolin'
Top boy, I ain't the lil' one
Thugged out, bitch nigga better get a gun
I'm him on a B, on the biggest one
It's a opp in the party, I'm finna kill the fun
Yeah, you tellin' all the lies
Stay with the money, I'm with Yeezy and Dolla $ign
That pussy wet, you would've swore I were in a water line
The hoes love me 'cause I'm a water sign

All this money on the floor (4Hunnid)
Ten racks, throw it up
Watch how I do it, make her drop to her toes
Bend it over, pick it up real slow
I do it, baby, do it
Up that work, ice like a jacuzzi
In my bag, call me '06 Gucci
What's happenin'? Tryna make a movie?",Do it stay waxed Do it smell fresh Can I feel your juice through the latex If you go round do you stay wet Can your homegirl watch Can she go next Need the lights on tell her watch this When I make you cream Ima talk shit I just wanna know And you fuck back and you got grip Stick your tongue out when you get your spot hit I just wanna know   All this money on the floor Ten racks throw it up Watch how I do it make her drop to her toes Bend it over pick it up real slow I do it baby do it Up that work ice like a jacuzzi In my bag call me 06 Gucci Whats happenin Tryna make a movie   Just touched down feelin like Lucci Fuckin on Tisha fuckin on Suzi Dont discriminate with this Uzi She just wanna drink do a lil tuci Beat it all day beat it all night I be on gorilla goin Kimbo Slicе I be with the killers need to pay your finеs Try me once you gon pay with your life All these dimes on me Whats your set Bitch throw it up Heard you got a man but he aint like us Your bitty bands aint doin enough Know its all on me This might make you fall in love Tellin your friends you found the one And Im like Who and Im like What You might also like All this money on the floor Ten racks throw it up Watch how I do it make her drop to her toes Bend it over pick it up real slow I do it baby do it Up that work ice like a jacuzzi In my bag call me 06 Gucci Whats happenin Tryna make a movie   You dont like it Thats your loss Your opinion dont change the show cost Let me know what these hoes cost I aint finna pay the whole cost Throwin so much money you gon need an audit God in me so anything you want I got it Southside Do or Die ChiTown top five Four three two one who am I Ye thats YeYe Text a ho a hunnid K Apple payday If I show up where she work I think she just might quit I just bought my bitch a bitch uh Spendin all this money like its free to me That shit fall off trees to me We aint even stress we the new kings and sheikhs We done made a mess they gon have to clean for weeks  All this money on the floor Yee Ten racks throw it up Watch how I do it make her drop to her toes Bend it over pick it up real slow I do it baby do it Up that work ice like a jacuzzi In my bag call me 06 Gucci Whats happenin Tryna make a movie   Do it do it She got the lil fat she finna lose it She finna lose Fuck her from the back goin stupid Goin stupid Pullin out the tracks she gotta glue it She gotta glue it Eeny meeny miny moe she choosy She what Fuck her like I love her Im confusin I would She dont wanna go home she refusin Hit it up the cherry bomb that pussy poolin Top boy I aint the lil one Thugged out bitch nigga better get a gun Im him on a B on the biggest one Its a opp in the party Im finna kill the fun Yeah you tellin all the lies Stay with the money Im with Yeezy and Dolla ign That pussy wet you wouldve swore I were in a water line The hoes love me cause Im a water sign  All this money on the floor 4Hunnid Ten racks throw it up Watch how I do it make her drop to her toes Bend it over pick it up real slow I do it baby do it Up that work ice like a jacuzzi In my bag call me 06 Gucci Whats happenin Tryna make a movie
78,Ty Dolla $ign,TALKING,False,"

You don't want no problems, you just— (Talking)
You don't want no problems, you just— (Talking)
You don't want no problems, you just— (Talking)
You don't want no problems, you just— (Talking)
You don't want no problems, you just— (Talking)


I love it here
We gonna take over the year for another year
It's your bestie, Miss, Miss Westie
Don't tryna test me
It's gonna get messy
It's gonna get messy
Just, just bless me
Bless me (Talking)
It's your bestie, Miss, Miss Westie (Talking)
Just tryna bless me (Talking)
Just bless me, bless me (Talking)


You don't want no problems, you just— (Talking)
You don't want no problems, you just— (Talking)
You don't want no problems, you just— (Talking)
You don't want no problems, you just— (Talking)
You don't want no problems, you just— (Talking)
You don't want no problems, you just— (Talking)
You don't want no problems, you just— (Talking)
(Talk)
You might also like


Once again, the clouds are gatherin' to release what they held in (Ooh)
What they held in (Held in)
What they held in (Held in)
What they held in (Held in)


Once again, the clouds are gatherin' to release what they held in (Again, once—, yeah)
Once again, the clouds are gatherin' to release what they held in


How much to stop the clock from speedin'? They might try to slow down
How much to stop my daughter from growin'? I just can't take it now
'Cause she just doing all the shit I did when I was her age
I don't know how I'm gonna tell her, but her dad's just afraid
Of her choices, know that I've been through it
I just hope I haven't been the wrong influence
Put her on game before the world put her through it
Ooh-ooh, oh-oh
That's why I gotta break the curses that were sent for me
This is hard work working, this ain't destiny
My motivation is just lookin' at my family tree
I'm tryna make sure I contribute for the legacy

Once again, the clouds are gatherin' to release what they held in (Again-again, once again)
Once again, the clouds are gatherin' to release what they held in


Once again, the clouds are gathering to release what they held in (Oh, oh-oh, oh, oh-oh, oh)
Once again, the clouds are gathering to release what they held in (Oh, oh-oh, oh, oh-oh, oh)
Once again, the clouds are gathering to release what they held in (Oh, oh-oh, oh, oh-oh, oh)
Once again, the clouds are gathering to release what they held in (Oh, oh-oh, oh, oh-oh, oh)",  You dont want no problems you just Talking You dont want no problems you just Talking You dont want no problems you just Talking You dont want no problems you just Talking You dont want no problems you just Talking   I love it here We gonna take over the year for another year Its your bestie Miss Miss Westie Dont tryna test me Its gonna get messy Its gonna get messy Just just bless me Bless me Talking Its your bestie Miss Miss Westie Talking Just tryna bless me Talking Just bless me bless me Talking   You dont want no problems you just Talking You dont want no problems you just Talking You dont want no problems you just Talking You dont want no problems you just Talking You dont want no problems you just Talking You dont want no problems you just Talking You dont want no problems you just Talking Talk You might also like   Once again the clouds are gatherin to release what they held in Ooh What they held in Held in What they held in Held in What they held in Held in   Once again the clouds are gatherin to release what they held in Again once yeah Once again the clouds are gatherin to release what they held in   How much to stop the clock from speedin They might try to slow down How much to stop my daughter from growin I just cant take it now Cause she just doing all the shit I did when I was her age I dont know how Im gonna tell her but her dads just afraid Of her choices know that Ive been through it I just hope I havent been the wrong influence Put her on game before the world put her through it Oohooh ohoh Thats why I gotta break the curses that were sent for me This is hard work working this aint destiny My motivation is just lookin at my family tree Im tryna make sure I contribute for the legacy  Once again the clouds are gatherin to release what they held in Againagain once again Once again the clouds are gatherin to release what they held in   Once again the clouds are gathering to release what they held in Oh ohoh oh ohoh oh Once again the clouds are gathering to release what they held in Oh ohoh oh ohoh oh Once again the clouds are gathering to release what they held in Oh ohoh oh ohoh oh Once again the clouds are gathering to release what they held in Oh ohoh oh ohoh oh
79,Ty Dolla $ign,STARS,False,"I hope he's bright and big, and strong
I hope he's bright and big, and strong


You already know what I'm on
Tell 'em don't wait up for me
Pullin' up, drop top Porsche
This that glory
I'ma come through and just black out
Just black out
Keep a few Jews on the staff now
I cash out
We finna go where the stars at
And beyond that
This that rip up the contract
Fuck all that


(I hope he's bright and big, and strong)
I ain't gotta ask nobody
Plug talk, plug talk, shawty
And she wanna back it up for me
I'ma blow your back out, shawty (Oh-oh)
Got a hundred racks in the morning (Oh-oh)
Woo-ooh, woo-ooh, woo-ooh
(I hope he's bright and big, and strong)
I ain't gotta ask nobody
Plug talk, plug talk, shawty
And she wanna back it up for me
I'ma blow your back out, shawty (Oh-oh)
Got a hundred racks in the morning (Oh-oh)
Woo-ooh, woo-ooh, woo-ooh
You might also like
I hope he's bright and big, and strong, ooh-ooh-ooh, ooh-ooh-ooh, ooh-ooh
I hope he's bright and big, and strong, ooh-ooh-ooh, ooh-ooh-ooh, ooh-ooh


And we'll be way up in the stars",I hope hes bright and big and strong I hope hes bright and big and strong   You already know what Im on Tell em dont wait up for me Pullin up drop top Porsche This that glory Ima come through and just black out Just black out Keep a few Jews on the staff now I cash out We finna go where the stars at And beyond that This that rip up the contract Fuck all that   I hope hes bright and big and strong I aint gotta ask nobody Plug talk plug talk shawty And she wanna back it up for me Ima blow your back out shawty Ohoh Got a hundred racks in the morning Ohoh Wooooh wooooh wooooh I hope hes bright and big and strong I aint gotta ask nobody Plug talk plug talk shawty And she wanna back it up for me Ima blow your back out shawty Ohoh Got a hundred racks in the morning Ohoh Wooooh wooooh wooooh You might also like I hope hes bright and big and strong oohoohooh oohoohooh oohooh I hope hes bright and big and strong oohoohooh oohoohooh oohooh   And well be way up in the stars
